"locus_tag","gene_name","gene_function","DNA_molecule","COG","description","theme","model","FDR","logFC","zscore"
"SL1344_2488","ndk","Major role in the synthesis of nucleoside triphosphates other than ATP. The ATP gamma phosphate is transferred to the NDP beta phosphate via a ping-pong mechanism, using a phosphorylated active-site intermediate","Chromosome","F","Nucleotide transport and metabolism","Metabolism","Phox-liver",0.257421738663034,-1.09601983430423,-0.933604799205983
"SL1344_2489","SL1344_2489","4Fe-4S dicluster domain","Chromosome","C","Energy production and conversion","Metabolism","Phox-liver",0.83105602781514,0.216970446332307,0.184818416274644
"SL1344_2490","SL1344_2490","DMSO reductase anchor subunit (DmsC)","Chromosome","S","Function Unknown","Poorly characterised","Phox-liver",0.967464050230944,0.682515275175391,0.581375917197375
"SL1344_2492","SL1344_2492","Molybdopterin oxidoreductase Fe4S4 domain","Chromosome","C","Energy production and conversion","Metabolism","Phox-liver",0.639290818462711,0.502351005422598,0.427909509362314
"SL1344_2493","pbpC","Penicillin-Binding Protein C-terminus Family","Chromosome","M","Cell wall/membrane/envelop biogenesis","Cellular processes and signaling","Phox-liver",0.999204941602324,0.162716290588561,0.138603978730834
"SL1344_2494","SL1344_2494","Alpha-2-Macroglobulin","Chromosome","S","Function Unknown","Poorly characterised","Phox-liver",0.259763040035163,0.974284233302811,0.82990873662396
"SL1344_2496","SL1344_2496","Domain of unknown function (DUF5066)","Chromosome","S","Function Unknown","Poorly characterised","Phox-liver",0.684699250329853,0.443578976918155,0.377846685539741
"SL1344_2497","sseBb","SseB protein N-terminal domain","Chromosome","S","Function Unknown","Poorly characterised","Phox-liver",0.649589376652284,-0.4380639650662,-0.373148922441383
"SL1344_2498","pepB","Probably plays an important role in intracellular peptide degradation","Chromosome","E","Amino acid transport and metabolism","Metabolism","Phox-liver",0.999204941602324,-0.0665328456901791,-0.056673594853887
"SL1344_2499","yfhJ","Iron-sulphur cluster assembly","Chromosome","S","Function Unknown","Poorly characterised","Phox-liver",0.999204941602324,0.143825739088554,0.122512746630778
"SL1344_2501","hscA","Chaperone involved in the maturation of iron-sulfur cluster-containing proteins. Has a low intrinsic ATPase activity which is markedly stimulated by HscB. Involved in the maturation of IscU","Chromosome","F","Nucleotide transport and metabolism","Metabolism","Phox-liver",3.01e-11,-4.2361605578733,-3.60841994209734
"SL1344_2503","iscA","Iron-sulphur cluster biosynthesis","Chromosome","C","Energy production and conversion","Metabolism","Phox-liver",1.19e-07,-3.27753847865625,-2.79185244416515
"SL1344_2507","SL1344_2507","Catalyzes the formation of 2'O-methylated cytidine (Cm32) or 2'O-methylated uridine (Um32) at position 32 in tRNA","Chromosome","J"," Translation, ribosomal structure and biogenesis","Information storage and processing","Phox-liver",0.40387448588929,0.758891733182187,0.646434436678243
"SL1344_2509","SL1344_2509","Prolyl oligopeptidase family","Chromosome","S","Function Unknown","Poorly characterised","Phox-liver",0.493453113893851,0.744622988123493,0.634280122998418
"SL1344_2510","asrA","4Fe-4S dicluster domain","Chromosome","C","Energy production and conversion","Metabolism","Phox-liver",0.403680810219971,0.759993694336901,0.647373102376052
"SL1344_2514","SL1344_2514","Protein of unknown function (DUF1007)","Chromosome","S","Function Unknown","Poorly characterised","Phox-liver",0.999204941602324,-0.00663148965167807,-0.00564879427444095
"SL1344_2515","csiE","PRD domain","Chromosome","K","Transcription","Information storage and processing","Phox-liver",0.999204941602324,0.531441413783433,0.452689120101547
"SL1344_2516","hcaT","LacY proton/sugar symporter","Chromosome","EGP","Amino acid transport and metabolism;Carbohydrate transport and metabolism;Inorganic ion transport and metabolism","Metabolism","Phox-liver",0.698122011309472,-0.403872581481492,-0.344024230709467
"SL1344_2517","glyA","Catalyzes the reversible interconversion of serine and glycine with tetrahydrofolate (THF) serving as the one-carbon carrier. This reaction serves as the major source of one-carbon groups required for the biosynthesis of purines, thymidylate, methionine, and other important biomolecules. Also exhibits THF- independent aldolase activity toward beta-hydroxyamino acids, producing glycine and aldehydes, via a retro-aldol mechanism","Chromosome","E","Amino acid transport and metabolism","Metabolism","Phox-liver",2.83e-08,-3.66653586217004,-3.12320577624932
"SL1344_2518","hmpA","Is involved in NO detoxification in an aerobic process, termed nitric oxide dioxygenase (NOD) reaction that utilizes O(2) and NAD(P)H to convert NO to nitrate, which protects the bacterium from various noxious nitrogen compounds. Therefore, plays a central role in the inducible response to nitrosative stress","Chromosome","C","Energy production and conversion","Metabolism","Phox-liver",0.953515588848026,-0.744437993230674,-0.634122541799284
"SL1344_2519","cadC","Transcriptional regulatory protein, C terminal","Chromosome","K","Transcription","Information storage and processing","Phox-liver",0.314545368103024,0.93604862661337,0.797339119917639
"SL1344_2520","cadB","Amino acid permease","Chromosome","E","Amino acid transport and metabolism","Metabolism","Phox-liver",0.898720624663262,-0.145365983053296,-0.123824747666183
"SL1344_2522","yjdL","POT family","Chromosome","U"," Intracellular trafficking, secretion, and vesicular transport","Cellular processes and signaling","Phox-liver",0.92694791183179,-0.100729921178539,-0.085803135027774
"SL1344_2523","glnB","Nitrogen regulatory protein P-II","Chromosome","K","Transcription","Information storage and processing","Phox-liver",0.683185009954004,-0.395154759508387,-0.336598269811706
"SL1344_2524","yfhA","Sigma-54 interaction domain","Chromosome","F","Nucleotide transport and metabolism","Metabolism","Phox-liver",0.839362714133027,-0.213567850324681,-0.181920038103874
"SL1344_2526","yfhK","His Kinase A (phosphoacceptor) domain","Chromosome","T","Signal transduction mechanisms","Cellular processes and signaling","Phox-liver",0.999204941602324,-0.260511989165478,-0.221907702509767
"SL1344_2527","purG","Phosphoribosylformylglycinamidine synthase involved in the purines biosynthetic pathway. Catalyzes the ATP-dependent conversion of formylglycinamide ribonucleotide (FGAR) and glutamine to yield formylglycinamidine ribonucleotide (FGAM) and glutamate","Chromosome","F","Nucleotide transport and metabolism","Metabolism","Phox-liver",5.83e-19,-5.55730197347705,-4.73378640667455
"SL1344_2529","yfhD","Murein-degrading enzyme that degrades murein glycan strands and insoluble, high-molecular weight murein sacculi, with the concomitant formation of a 1,6-anhydromuramoyl product. Lytic transglycosylases (LTs) play an integral role in the metabolism of the peptidoglycan (PG) sacculus. Their lytic action creates space within the PG sacculus to allow for its expansion as well as for the insertion of various structures such as secretion systems and flagella","Chromosome","M","Cell wall/membrane/envelop biogenesis","Cellular processes and signaling","Phox-liver",0.692297919543225,0.803300051954745,0.684262054603651
"SL1344_2530","yfhC","Catalyzes the deamination of adenosine to inosine at the wobble position 34 of tRNA(Arg2)","Chromosome","F","Nucleotide transport and metabolism","Metabolism","Phox-liver",0.781718790089765,0.274362537823455,0.23370579073226
"SL1344_2531","yfhB","haloacid dehalogenase-like hydrolase","Chromosome","E","Amino acid transport and metabolism","Metabolism","Phox-liver",0.98437353427509,-0.656059011635522,-0.558840107318022
"SL1344_2532","SL1344_2532","phosphotransferase system, EIIB","Chromosome","G","Carbohydrate transport and metabolism","Metabolism","Phox-liver",0.999204941602324,0.265584934869353,0.226228907571038
"SL1344_2534","yfhH","Helix-turn-helix domain, rpiR family","Chromosome","K","Transcription","Information storage and processing","Phox-liver",0.999204941602324,0.310488007063266,0.264477963278997
"SL1344_2535","SL1344_2535","Catalyzes the NADPH-dependent reduction of ketopantoate into pantoic acid","Chromosome","H","Coenzyme transport and metabolism","Metabolism","Phox-liver",0.240645529390074,1.13919513054332,0.970382111544991
"SL1344_2536","SL1344_2536","Major facilitator superfamily","Chromosome","P","Inorganic ion transport and metabolism","Metabolism","Phox-liver",0.585687675471958,-0.547737023422039,-0.46656994496294
"SL1344_2537","SL1344_2537","LysR substrate binding domain","Chromosome","K","Transcription","Information storage and processing","Phox-liver",0.646363257997837,-0.497977638621019,-0.424184215250977
"SL1344_2545","lepA","Required for accurate and efficient protein synthesis under certain stress conditions. May act as a fidelity factor of the translation reaction, by catalyzing a one-codon backward translocation of tRNAs on improperly translocated ribosomes. Back- translocation proceeds from a post-translocation (POST) complex to a pre-translocation (PRE) complex, thus giving elongation factor G a second chance to translocate the tRNAs correctly. Binds to ribosomes in a GTP-dependent manner","Chromosome","F","Nucleotide transport and metabolism","Metabolism","Phox-liver",0.149100889762851,-1.50261315100517,-1.27994658967007
"SL1344_2546","gogB","Leucine-rich repeat (LRR) protein","Chromosome","S","Function Unknown","Poorly characterised","Phox-liver",0.145221312708891,1.13449665421256,0.966379884656334
"SL1344_2547","SL1344_2547","hypothetical transposase","Chromosome",NA,"no category","no theme","Phox-liver",0.201193025009179,1.04527172661051,0.890376861708341
"SL1344_2551","SL1344_2551","Appr-1'-p processing enzyme","Chromosome","S","Function Unknown","Poorly characterised","Phox-liver",0.518025546860551,-0.597872200377849,-0.509275779611178
"SL1344_2552","SL1344_2552","Phage Tail Collar Domain","Chromosome","M","Cell wall/membrane/envelop biogenesis","Cellular processes and signaling","Phox-liver",0.81426435402317,0.250476306640653,0.213359169832498
"SL1344_2553","SL1344_2553","Fibronectin type III protein","Chromosome","D","Cell cycle control, cell division, chromosome partitioning","Cellular processes and signaling","Phox-liver",0.686605288704513,-0.436725282690661,-0.372008614345399
"SL1344_2554","SL1344_2554","virus tail assembly","Chromosome","S","Function Unknown","Poorly characterised","Phox-liver",0.957194721924132,0.619844787405609,0.527992332047576
"SL1344_2555","SL1344_2555","JAB/MPN domain","Chromosome","M","Cell wall/membrane/envelop biogenesis","Cellular processes and signaling","Phox-liver",0.543600456472507,-0.663698633554747,-0.565347642551119
"SL1344_2556","SL1344_2556","Phage minor tail protein L","Chromosome","S","Function Unknown","Poorly characterised","Phox-liver",0.999204941602324,0.340747035005765,0.29025302028274
"SL1344_2558","SL1344_2558","tail length tape measure","Chromosome","D","Cell cycle control, cell division, chromosome partitioning","Cellular processes and signaling","Phox-liver",0.827566411602163,0.239642120701578,0.204130460942726
"SL1344_2561","SL1344_2561","Lambda phage tail tube protein, TTP","Chromosome","N","Cell motility","Cellular processes and signaling","Phox-liver",0.999204941602324,0.431837217016144,0.367844892640983
"SL1344_2563","gipA","Probable transposase","Chromosome","L","Replication, recombination and repair ","Information storage and processing","Phox-liver",0.301413821449403,0.966848161368325,0.823574588073004
"SL1344_2567","SL1344_2567","Phage major capsid protein E","Chromosome","S","Function Unknown","Poorly characterised","Phox-liver",0.999204941602324,-0.0888027597124964,-0.0756434145217388
"SL1344_2569","SL1344_2569","Peptidase family S49","Chromosome","OU","Post-translational modification, protein turnover, and chaperones; Intracellular trafficking, secretion, and vesicular transport","Cellular processes and signaling","Phox-liver",0.999204941602324,-0.184801267480024,-0.157416266401989
"SL1344_2570","SL1344_2570","Phage portal protein, lambda family","Chromosome","S","Function Unknown","Poorly characterised","Phox-liver",0.999204941602324,0.274045690372225,0.2334358957068
"SL1344_2572","SL1344_2572","Phage terminase large subunit (GpA)","Chromosome","S","Function Unknown","Poorly characterised","Phox-liver",0.201126260012988,1.10601777343887,0.942121181543347
"SL1344_2574","SL1344_2574","lysozyme inhibitor activity","Chromosome","S","Function Unknown","Poorly characterised","Phox-liver",0.66315338938537,0.471311148245783,0.401469331256104
"SL1344_2578","SL1344_2578","ORF6N domain","Chromosome","S","Function Unknown","Poorly characterised","Phox-liver",0.999204941602324,0.577082874276123,0.491567145138198
"SL1344_2579","SL1344_2579","Phage antitermination protein Q","Chromosome","S","Function Unknown","Poorly characterised","Phox-liver",0.0641227498797608,-1.39925892389127,-1.19190803468076
"SL1344_2580","SL1344_2580","-","Chromosome","-","no category","no theme","Phox-liver",0.999204941602324,0.307390537470905,0.261839495993723
"SL1344_2582","SL1344_2582","Protein of unknown function (DUF1367)","Chromosome","S","Function Unknown","Poorly characterised","Phox-liver",0.675402672425719,0.437271750304152,0.372474102989489
"SL1344_2585","SL1344_2585","predicted bacteriophage protein","Chromosome",NA,"no category","no theme","Phox-liver",0.585687675471958,-0.510471675289256,-0.434826807866399
"SL1344_2586","SL1344_2586","-","Chromosome","-","no category","no theme","Phox-liver",0.273018527588938,0.956609461531122,0.814853122451253
"SL1344_2587","SL1344_2587","Protein of unknown function (DUF550)","Chromosome","S","Function Unknown","Poorly characterised","Phox-liver",0.834264158010727,0.229699549304424,0.19566124160718
"SL1344_2590","gpP","Replication protein P","Chromosome","S","Function Unknown","Poorly characterised","Phox-liver",0.999204941602324,0.425271377186592,0.362252019789755
"SL1344_2594","SL1344_2594","AAA domain","Chromosome","D","Cell cycle control, cell division, chromosome partitioning","Cellular processes and signaling","Phox-liver",0.483935474554252,0.696900702605812,0.593629622529447
"SL1344_2597","recEb","double-stranded DNA specific 5'-3' exodeoxyribonuclease activity","Chromosome","S","Function Unknown","Poorly characterised","Phox-liver",0.520102559324863,0.636760499433359,0.542401368669728
"SL1344_2597A","SL1344_2597A","RecT family","Chromosome","S","Function Unknown","Poorly characterised","Phox-liver",0.999204941602324,-0.364149571302373,-0.3101876232126
"SL1344_2599","SL1344_2599","-","Chromosome","-","no category","no theme","Phox-liver",0.999204941602324,0.337299585237371,0.287316435060414
"SL1344_2600","SL1344_2600","Arm DNA-binding domain","Chromosome","L","Replication, recombination and repair ","Information storage and processing","Phox-liver",0.0767708142387183,1.23141646059414,1.04893751139253
"SL1344_2602","rseB","MucB/RseB C-terminal domain","Chromosome","T","Signal transduction mechanisms","Cellular processes and signaling","Phox-liver",0.851886482314575,-0.85900170938795,-0.73170949403469
"SL1344_2605","nadB","Catalyzes the oxidation of L-aspartate to iminoaspartate","Chromosome","H","Coenzyme transport and metabolism","Metabolism","Phox-liver",0.584338069373837,1.05981448128748,0.902764580557164
"SL1344_2606","yfiC","Specifically methylates the adenine in position 37 of tRNA(1)(Val) (anticodon cmo5UAC)","Chromosome","J"," Translation, ribosomal structure and biogenesis","Information storage and processing","Phox-liver",0.773047836680243,-0.307089154943688,-0.26158277420366
"SL1344_2607","srmB","DEAD-box RNA helicase involved in the assembly of the 50S ribosomal subunit at low temperature. Exhibits RNA-stimulated ATP hydrolysis and RNA unwinding activity","Chromosome","F","Nucleotide transport and metabolism","Metabolism","Phox-liver",0.147169675226184,-1.3894150274226,-1.18352286800915
"SL1344_2608","yfiE","LysR substrate binding domain","Chromosome","K","Transcription","Information storage and processing","Phox-liver",0.999204941602324,-0.161932758572448,-0.137936555361586
"SL1344_2609","yfiK","LysE type translocator","Chromosome","U"," Intracellular trafficking, secretion, and vesicular transport","Cellular processes and signaling","Phox-liver",0.573893347912538,-0.537806555818804,-0.458111035805858
"SL1344_2611","ung","Excises uracil residues from the DNA which can arise as a result of misincorporation of dUMP residues by DNA polymerase or due to deamination of cytosine","Chromosome","L","Replication, recombination and repair ","Information storage and processing","Phox-liver",0.999204941602324,-0.334428897661417,-0.284871143822019
"SL1344_2612","yfiF","RNA 2'-O ribose methyltransferase substrate binding","Chromosome","H","Coenzyme transport and metabolism","Metabolism","Phox-liver",0.37008092389314,0.97782323789164,0.832923309504058
"SL1344_2614","yfiP","DTW domain","Chromosome","S","Function Unknown","Poorly characterised","Phox-liver",0.999204941602324,0.083819861200076,0.0713989128990969
"SL1344_2615","yfiQ","CoA binding domain","Chromosome","CJ","Energy production and conversion; Translation, ribosomal structure and biogenesis","Metabolism;Information storage and processing","Phox-liver",0.999204941602324,0.311187471457762,0.265073776689609
"SL1344_2618","kgtP","MFS/sugar transport protein","Chromosome","EGP","Amino acid transport and metabolism;Carbohydrate transport and metabolism;Inorganic ion transport and metabolism","Metabolism","Phox-liver",0.999204941602324,0.625000075533981,0.532383677520802
"SL1344_2619","SL1344_2619","Domain of unknown function (DUF4385)","Chromosome","S","Function Unknown","Poorly characterised","Phox-liver",0.999204941602324,0.308557291276366,0.262833352964351
"SL1344_2620","clpB","Part of a stress-induced multi-chaperone system, it is involved in the recovery of the cell from heat-induced damage, in cooperation with DnaK, DnaJ and GrpE","Chromosome","O","Post-translational modification, protein turnover, and chaperones","Cellular processes and signaling","Phox-liver",0.999204941602324,-0.0489576404654593,-0.0417027928380232
"SL1344_2621","yfiH","Multi-copper polyphenol oxidoreductase laccase","Chromosome","S","Function Unknown","Poorly characterised","Phox-liver",0.533485199522028,0.576263478067726,0.490869172155714
"SL1344_2622","rluD","Responsible for synthesis of pseudouridine from uracil","Chromosome","J"," Translation, ribosomal structure and biogenesis","Information storage and processing","Phox-liver",0.248536156509664,-1.18739091918823,-1.01143594850312
"SL1344_2625","pheA","Prephenate dehydratase","Chromosome","E","Amino acid transport and metabolism","Metabolism","Phox-liver",0.999204941602324,-0.193066631813502,-0.164456817646958
"SL1344_2626","SL1344_2626","SMP-30/Gluconolaconase/LRE-like region","Chromosome","G","Carbohydrate transport and metabolism","Metabolism","Phox-liver",0.999204941602324,0.0101723801357974,0.00866497358613668
"SL1344_2627","tyrA","Prephenate dehydrogenase","Chromosome","E","Amino acid transport and metabolism","Metabolism","Phox-liver",0.999204941602324,0.0432277911617072,0.0368220282375305
"SL1344_2628","aroF","Stereospecific condensation of phosphoenolpyruvate (PEP) and D-erythrose-4-phosphate (E4P) giving rise to 3-deoxy-D- arabino-heptulosonate-7-phosphate (DAHP)","Chromosome","E","Amino acid transport and metabolism","Metabolism","Phox-liver",0.999204941602324,-0.137946844107659,-0.117505022868483
"SL1344_2629","yfiR","Domain of unknown function (DUF4154)","Chromosome","S","Function Unknown","Poorly characterised","Phox-liver",0.346096806126311,0.853647216295151,0.727148463027504
"SL1344_2630","yfiN","Periplasmic sensor domain","Chromosome","T","Signal transduction mechanisms","Cellular processes and signaling","Phox-liver",0.999204941602324,0.139514539682298,0.118840407563511
"SL1344_2635","cIIb","Phage regulatory protein CII (CP76)","Chromosome","S","Function Unknown","Poorly characterised","Phox-liver",0.999204941602324,0.109429957443035,0.0932139458138359
"SL1344_2637","SL1344_2637","Family of unknown function (DUF5347)","Chromosome","S","Function Unknown","Poorly characterised","Phox-liver",0.999204941602324,0.551457189194969,0.469738833436253
"SL1344_2640","SL1344_2640","hypothetical bacteriophage-related protein","Chromosome",NA,"no category","no theme","Phox-liver",0.758737531746147,0.303616852097268,0.258625018786969
"SL1344_2641","SL1344_2641","endonuclease activity","Chromosome","L","Replication, recombination and repair ","Information storage and processing","Phox-liver",0.684699250329853,0.405538774836405,0.345443517171139
"SL1344_2642","gpF","Phage P2 GpU","Chromosome","S","Function Unknown","Poorly characterised","Phox-liver",0.999204941602324,-0.00483122566650279,-0.00411530460227249
"SL1344_2643","gpD","Phage late control gene D protein (GPD)","Chromosome","S","Function Unknown","Poorly characterised","Phox-liver",0.999204941602324,0.377090693974681,0.32121104984762
"SL1344_2644","SL1344_2644","predicted bacteriophage protein","Chromosome",NA,"no category","no theme","Phox-liver",0.487133929072684,0.654742607896094,0.557718776471302
"SL1344_2645","gpB","Ogr/Delta-like zinc finger","Chromosome","S","Function Unknown","Poorly characterised","Phox-liver",0.999204941602324,0.447532503145703,0.381214353664259
"SL1344_2651","corE","Cytochrome C assembly protein","Chromosome","S","Function Unknown","Poorly characterised","Phox-liver",0.190017574193918,-1.34199553918013,-1.14313029443208
"SL1344_2652","corB","Domain of unknown function DUF21","Chromosome","P","Inorganic ion transport and metabolism","Metabolism","Phox-liver",0.692487808718819,0.389041914818854,0.331391264463512
"SL1344_2656","recN","May be involved in recombinational repair of damaged DNA","Chromosome","L","Replication, recombination and repair ","Information storage and processing","Phox-liver",0.999204941602324,-0.311619276973429,-0.265441594578604
"SL1344_2660","smpB","Required for rescue of stalled ribosomes mediated by trans-translation. Binds to transfer-messenger RNA (tmRNA), required for stable association of tmRNA with ribosomes. tmRNA and SmpB together mimic tRNA shape, replacing the anticodon stem-loop with SmpB. tmRNA is encoded by the ssrA gene","Chromosome","J"," Translation, ribosomal structure and biogenesis","Information storage and processing","Phox-liver",0.00157028906902671,-2.17141735171744,-1.84964322468623
"SL1344_2661","bapA","Domain of unknown function","Chromosome","M","Cell wall/membrane/envelop biogenesis","Cellular processes and signaling","Phox-liver",0.447135504049062,0.725532090253443,0.618018233099368
"SL1344_2662","SL1344_2662","Outer membrane efflux protein","Chromosome","MU","Cell wall/membrane/envelop biogenesis; Intracellular trafficking, secretion, and vesicular transport","Cellular processes and signaling","Phox-liver",0.999204941602324,0.612313254353141,0.521576868400765
"SL1344_2663","SL1344_2663","ABC transporter transmembrane region","Chromosome","V","Defense mechanisms","Cellular processes and signaling","Phox-liver",0.0228949754817383,-1.62068307161525,-1.38052017517768
"SL1344_2664","SL1344_2664","HlyD membrane-fusion protein of T1SS","Chromosome","M","Cell wall/membrane/envelop biogenesis","Cellular processes and signaling","Phox-liver",0.250629452376446,1.00270651580467,0.854119228549016
"SL1344_2665","SL1344_2665","Ogr/Delta-like zinc finger","Chromosome","S","Function Unknown","Poorly characterised","Phox-liver",0.899792962965739,0.141425633397958,0.120468303527461
"SL1344_2666","SL1344_2666","Phage late control gene D protein (GPD)","Chromosome","S","Function Unknown","Poorly characterised","Phox-liver",0.999204941602324,0.390635549049978,0.332748744063596
"SL1344_2667","gpU","Phage P2 GpU","Chromosome","S","Function Unknown","Poorly characterised","Phox-liver",0.82220370993769,0.247117764955008,0.210498317740308
"SL1344_2668","SL1344_2668","amidase activity","Chromosome","S","Function Unknown","Poorly characterised","Phox-liver",0.999204941602324,0.305085484211538,0.259876019861253
"SL1344_2670","gpE","Phage tail assembly chaperone proteins, E, or 41 or 14","Chromosome","S","Function Unknown","Poorly characterised","Phox-liver",0.546472882536085,0.655282114735631,0.558178335832211
"SL1344_2671","SL1344_2671","Phage tail tube protein FII","Chromosome","S","Function Unknown","Poorly characterised","Phox-liver",0.999204941602324,-0.494266716822831,-0.421023200922741
"SL1344_2675","SL1344_2675","Caudovirales tail fibre assembly protein, lambda gpK","Chromosome","S","Function Unknown","Poorly characterised","Phox-liver",0.388873519393257,-0.766415003445956,-0.65284286196777
"SL1344_2676","SL1344_2676","tail collar domain protein","Chromosome","M","Cell wall/membrane/envelop biogenesis","Cellular processes and signaling","Phox-liver",0.492377313241198,-0.624661707415932,-0.532095450894767
"SL1344_2677","gpI","Phage tail protein (Tail_P2_I)","Chromosome","S","Function Unknown","Poorly characterised","Phox-liver",0.999204941602324,-0.150792214747055,-0.128446886602302
"SL1344_2680","SL1344_2680","Type VI secretion system, phage-baseplate injector","Chromosome","S","Function Unknown","Poorly characterised","Phox-liver",0.999204941602324,0.272219691135335,0.231880484392561
"SL1344_2681","SL1344_2681","Phage virion morphogenesis family","Chromosome","S","Function Unknown","Poorly characterised","Phox-liver",0.999204941602324,0.283521054744526,0.241507141659955
"SL1344_2682","SL1344_2682","P2 phage tail completion R family protein","Chromosome","S","Function Unknown","Poorly characterised","Phox-liver",0.999204941602324,-0.0287770741075523,-0.0245127083041999
