"locus_tag","gene_name","gene_function","DNA_molecule","COG","description","theme","model","FDR","logFC","zscore"
"SL1344_1259","SL1344_1259","Fructosamine kinase","Chromosome","G","Carbohydrate transport and metabolism","Metabolism","Phox-liver",0.999204941602324,0.389930218124457,0.33214793346101
"SL1344_1263","SL1344_1263","Uncharacterized protein conserved in bacteria (DUF2219)","Chromosome","S","Function Unknown","Poorly characterised","Phox-liver",0.520888827206824,0.611105267650063,0.520547888679713
"SL1344_1265","SL1344_1265","DNA/RNA non-specific endonuclease","Chromosome","F","Nucleotide transport and metabolism","Metabolism","Phox-liver",0.735556948730916,-0.341075911132146,-0.290533161499462
"SL1344_1266","rfc","-","Chromosome","-","no category","no theme","Phox-liver",0.715990063217768,-0.41200127430662,-0.350948363280141
"SL1344_1274","btuC","Part of the ABC transporter complex BtuCDF involved in vitamin B12 import. Involved in the translocation of the substrate across the membrane","Chromosome","U"," Intracellular trafficking, secretion, and vesicular transport","Cellular processes and signaling","Phox-liver",0.989084899372673,-0.0179053992531784,-0.0152520658397377
"SL1344_1275","btuE","Non-specific peroxidase that can use thioredoxin or glutathione as a reducing agent","Chromosome","O","Post-translational modification, protein turnover, and chaperones","Cellular processes and signaling","Phox-liver",0.674385781205053,0.831216084834417,0.708041316123857
"SL1344_1276","btuD","Part of the ABC transporter complex BtuCDF involved in vitamin B12 import. Responsible for energy coupling to the transport system","Chromosome","H","Coenzyme transport and metabolism","Metabolism","Phox-liver",0.869661453962226,0.179810041473942,0.153164671305485
"SL1344_1278","ydiV","EAL domain","Chromosome","K","Transcription","Information storage and processing","Phox-liver",0.33396766213218,0.911109546659614,0.776095667925377
"SL1344_1279","ydiU","Uncharacterized ACR, YdiU/UPF0061 family","Chromosome","S","Function Unknown","Poorly characterised","Phox-liver",0.851886482314575,0.764681336415824,0.651366100499686
"SL1344_1283","pps","Catalyzes the phosphorylation of pyruvate to phosphoenolpyruvate","Chromosome","H","Coenzyme transport and metabolism","Metabolism","Phox-liver",0.794098646408132,0.77990089458933,0.664330329893947
"SL1344_1284","ydiD","AMP-binding enzyme C-terminal domain","Chromosome","IQ","Lipid transport and metabolism;Secondary metabolites biosynthesis, transport, and catabolism","Metabolism","Phox-liver",0.999204941602324,0.00577128022082846,0.00491605602662151
"SL1344_1285","ydiT","Could be a 3Fe-4S cluster-containing protein","Chromosome","C","Energy production and conversion","Metabolism","Phox-liver",0.999204941602324,0.185119980749637,0.157687750757261
"SL1344_1286","ydiS","part of an electron transfer system required for anaerobic carnitine reduction","Chromosome","C","Energy production and conversion","Metabolism","Phox-liver",0.502951983831499,0.942204906289476,0.802583123785977
"SL1344_1287","ydiR","Required for anaerobic carnitine reduction. May bring reductant to CaiA","Chromosome","C","Energy production and conversion","Metabolism","Phox-liver",0.61951510987613,0.466190577202274,0.397107558274204
"SL1344_1288","ydiQ","Required for anaerobic carnitine reduction. May bring reductant to CaiA","Chromosome","C","Energy production and conversion","Metabolism","Phox-liver",0.655507421362728,0.483442661651785,0.411803121560789
"SL1344_1289","ydiP","transcriptional regulator","Chromosome","K","Transcription","Information storage and processing","Phox-liver",0.30976122831468,0.943933827124791,0.804055842379908
"SL1344_1290","ydiO","Catalyzes the reduction of crotonobetainyl-CoA to gamma- butyrobetainyl-CoA","Chromosome","I","Lipid transport and metabolism","Metabolism","Phox-liver",0.815064691283,-0.243151789282386,-0.207120045006909
"SL1344_1291","ydiF","CoA transferase having broad substrate specificity for short-chain acyl-CoA thioesters with the activity decreasing when the length of the carboxylic acid chain exceeds four carbons","Chromosome","I","Lipid transport and metabolism","Metabolism","Phox-liver",0.293696716014906,0.963763173982421,0.820946753303209
"SL1344_1292","aroD","Involved in the third step of the chorismate pathway, which leads to the biosynthesis of aromatic amino acids. Catalyzes the cis-dehydration of 3-dehydroquinate (DHQ) and introduces the first double bond of the aromatic ring to yield 3- dehydroshikimate","Chromosome","E","Amino acid transport and metabolism","Metabolism","Phox-liver",7.94e-29,-7.58266471279466,-6.45901829972716
"SL1344_1293","aroE","The actual biological function of YdiB remains unclear, nor is it known whether 3-dehydroshikimate or quinate represents the natural substrate. Catalyzes the reversible NAD-dependent reduction of both 3-dehydroshikimate (DHSA) and 3-dehydroquinate to yield shikimate (SA) and quinate, respectively. It can use both NAD or NADP for catalysis, however it has higher catalytic efficiency with NAD","Chromosome","E","Amino acid transport and metabolism","Metabolism","Phox-liver",0.616537903452396,-0.512776986300534,-0.436790503555499
"SL1344_1294","ydiN","Major Facilitator Superfamily","Chromosome","EGP","Amino acid transport and metabolism;Carbohydrate transport and metabolism;Inorganic ion transport and metabolism","Metabolism","Phox-liver",0.746292188930284,-0.327962543809025,-0.279363014497161
"SL1344_1296","ydiM","Major Facilitator Superfamily","Chromosome","EGP","Amino acid transport and metabolism;Carbohydrate transport and metabolism;Inorganic ion transport and metabolism","Metabolism","Phox-liver",0.270736937196912,1.06194033397883,0.904575411176219
"SL1344_1297","ydiL","DNA binding","Chromosome","S","Function Unknown","Poorly characterised","Phox-liver",0.18447598316652,1.11611197910909,0.950719565042376
"SL1344_1298","ydiK","AI-2E family transporter","Chromosome","S","Function Unknown","Poorly characterised","Phox-liver",0.999204941602324,0.473086418685323,0.402981531081662
"SL1344_1299","ydiJ","FAD linked oxidases, C-terminal domain","Chromosome","C","Energy production and conversion","Metabolism","Phox-liver",0.852196759096365,0.224943854203574,0.191610274981624
"SL1344_1300","SL1344_1300","Catalyzes the hydrolysis of 1,4-dihydroxy-2-naphthoyl- CoA (DHNA-CoA) to 1,4-dihydroxy-2-naphthoate (DHNA)","Chromosome","Q","Secondary metabolites biosynthesis, transport, and catabolism","Metabolism","Phox-liver",0.999204941602324,0.478239557980134,0.407371046148848
"SL1344_1302","SL1344_1302","Sodium:dicarboxylate symporter family","Chromosome","U"," Intracellular trafficking, secretion, and vesicular transport","Cellular processes and signaling","Phox-liver",0.999204941602324,-0.247061442005082,-0.210450341075369
"SL1344_1304","sufB","Uncharacterized protein family (UPF0051)","Chromosome","O","Post-translational modification, protein turnover, and chaperones","Cellular processes and signaling","Phox-liver",0.604807899917029,0.839715891851832,0.715281568877879
"SL1344_1305","sufC","ABC transporter","Chromosome","O","Post-translational modification, protein turnover, and chaperones","Cellular processes and signaling","Phox-liver",0.567438349891983,0.966628782339223,0.823387717992734
"SL1344_1306","sufD","Uncharacterized protein family (UPF0051)","Chromosome","O","Post-translational modification, protein turnover, and chaperones","Cellular processes and signaling","Phox-liver",0.933136608865202,0.0971746374606804,0.0827746953612248
"SL1344_1307","sufS","Cysteine desulfurases mobilize the sulfur from L- cysteine to yield L-alanine, an essential step in sulfur metabolism for biosynthesis of a variety of sulfur-containing biomolecules. Component of the suf operon, which is activated and required under specific conditions such as oxidative stress and iron limitation. Acts as a potent selenocysteine lyase in vitro, that mobilizes selenium from L-selenocysteine. Selenocysteine lyase activity is however unsure in vivo","Chromosome","H","Coenzyme transport and metabolism","Metabolism","Phox-liver",0.999204941602324,0.403948142501347,0.344088594627493
"SL1344_1312","pykF","Pyruvate kinase, barrel domain","Chromosome","F","Nucleotide transport and metabolism","Metabolism","Phox-liver",0.179507294466033,-1.16763272438325,-0.994605645878823
"SL1344_1313","orf48","Amino acid permease","Chromosome","E","Amino acid transport and metabolism","Metabolism","Phox-liver",0.460432144754854,0.673930729946155,0.57406348326674
"SL1344_1314","orf32","Alpha/beta hydrolase family","Chromosome","I","Lipid transport and metabolism","Metabolism","Phox-liver",0.687392715584422,0.389598641144858,0.331865491620296
"SL1344_1316","orf408","Catalyzes the phosphorylation of ribose at O-5 in a reaction requiring ATP and magnesium. The resulting D-ribose-5- phosphate can then be used either for sythesis of nucleotides, histidine, and tryptophan, or as a component of the pentose phosphate pathway","Chromosome","H","Coenzyme transport and metabolism","Metabolism","Phox-liver",0.181318678630365,1.41738654033007,1.20734938818161
"SL1344_1317","ttrA","Molybdopterin oxidoreductase Fe4S4 domain","Chromosome","C","Energy production and conversion","Metabolism","Phox-liver",0.604706708834437,0.551748415187397,0.469986903750015
"SL1344_1318","ttrC","Polysulphide reductase, NrfD","Chromosome","C","Energy production and conversion","Metabolism","Phox-liver",0.999204941602324,0.0954588269138487,0.0813131442916976
"SL1344_1319","ttrB","4Fe-4S dicluster domain","Chromosome","C","Energy production and conversion","Metabolism","Phox-liver",0.999204941602324,0.30319714478566,0.258267506314918
"SL1344_1320","ttrS","ABC transporter, phosphonate, periplasmic substrate-binding protein","Chromosome","T","Signal transduction mechanisms","Cellular processes and signaling","Phox-liver",0.999204941602324,0.501202836834121,0.426931483535637
"SL1344_1321","ttrR","Sigma-70, region 4","Chromosome","K","Transcription","Information storage and processing","Phox-liver",0.307972335770812,0.991391591533298,0.844481020122696
"SL1344_1324","orf242","MerR family regulatory protein","Chromosome","K","Transcription","Information storage and processing","Phox-liver",0.999204941602324,-0.0718723120038913,-0.0612218258435615
"SL1344_1325","ssrB","Bacterial regulatory proteins, luxR family","Chromosome","KT","Transcription;Signal transduction mechanisms","Information storage and processing;Cellular processes and signaling","Phox-liver",5.67e-05,-3.39102629776753,-2.88852293246975
"SL1344_1326","ssrA","HAMP (Histidine kinases, Adenylyl cyclases, Methyl binding proteins, Phosphatases) domain","Chromosome","T","Signal transduction mechanisms","Cellular processes and signaling","Phox-liver",2.59e-11,-3.94464037475691,-3.36009903265354
"SL1344_1328","ssaC","Bacterial type II/III secretion system short domain","Chromosome","NU","Cell motility; Intracellular trafficking, secretion, and vesicular transport","Cellular processes and signaling","Phox-liver",3.06e-19,-4.97686246650299,-4.2393600355462
"SL1344_1329","ssaD","Inner membrane component of T3SS, periplasmic domain","Chromosome","S","Function Unknown","Poorly characterised","Phox-liver",1.44e-09,-3.59532799421864,-3.06254993300643
"SL1344_1333","sscA","Mediates coordination of peptidoglycan synthesis and outer membrane constriction during cell division","Chromosome","S","Function Unknown","Poorly characterised","Phox-liver",4.47e-12,-4.52980302507261,-3.85854864237035
"SL1344_1334","sseC","Secretion system effector C (SseC) like family","Chromosome","S","Function Unknown","Poorly characterised","Phox-liver",1.62e-15,-4.49279413685574,-3.82702396136448
"SL1344_1336","sseE","Type III secretion system regulator (LcrR)","Chromosome","S","Function Unknown","Poorly characterised","Phox-liver",0.151900010632506,-1.41231006497858,-1.20302517651785
"SL1344_1338","sseF","-","Chromosome","-","no category","no theme","Phox-liver",0.039270609870443,-1.63232243019176,-1.39043474121618
"SL1344_1339","sseG","-","Chromosome","-","no category","no theme","Phox-liver",0.130888546593359,-1.43300166166667,-1.22065056372948
"SL1344_1340","ssaG","Type III secretion needle MxiH, YscF, SsaG, EprI, PscF, EscF","Chromosome","S","Function Unknown","Poorly characterised","Phox-liver",2.64e-08,-3.49595255211402,-2.97790056192002
"SL1344_1344","SL1344_1344","Type III secretion system subunit","Chromosome","S","Function Unknown","Poorly characterised","Phox-liver",3.51e-09,-3.63150794115422,-3.09336851040519
"SL1344_1346","ssaL","HrpJ-like domain","Chromosome","S","Function Unknown","Poorly characterised","Phox-liver",3.95e-09,-3.65583347723455,-3.11408933727076
"SL1344_1348","ssaV","FHIPEP family","Chromosome","U"," Intracellular trafficking, secretion, and vesicular transport","Cellular processes and signaling","Phox-liver",5.32e-19,-4.88205568962949,-4.15860231646483
"SL1344_1349","ssaN","ATP synthase alpha/beta family, nucleotide-binding domain","Chromosome","NU","Cell motility; Intracellular trafficking, secretion, and vesicular transport","Cellular processes and signaling","Phox-liver",1.02e-16,-5.44226601756937,-4.63579719411177
"SL1344_1352","ssaQ","Type III flagellar switch regulator (C-ring) FliN C-term","Chromosome","NU","Cell motility; Intracellular trafficking, secretion, and vesicular transport","Cellular processes and signaling","Phox-liver",1.56e-11,-4.10320056000189,-3.49516278357706
"SL1344_1353","ssaR","FliP family","Chromosome","U"," Intracellular trafficking, secretion, and vesicular transport","Cellular processes and signaling","Phox-liver",8.1e-20,-4.78325306732726,-4.07444088118017
"SL1344_1354","ssaS","Bacterial export proteins, family 3","Chromosome","U"," Intracellular trafficking, secretion, and vesicular transport","Cellular processes and signaling","Phox-liver",4.53e-14,-4.36926391651538,-3.72179921729774
"SL1344_1355","ssaT","Bacterial export proteins, family 1","Chromosome","U"," Intracellular trafficking, secretion, and vesicular transport","Cellular processes and signaling","Phox-liver",1.64e-09,-3.49680382484577,-2.97862568776439
"SL1344_1356","ssaU","FlhB HrpN YscU SpaS Family","Chromosome","U"," Intracellular trafficking, secretion, and vesicular transport","Cellular processes and signaling","Phox-liver",6.74e-05,-2.74660377315326,-2.33959494515988
"SL1344_1357","norM","Multidrug efflux pump that functions probably as a Na( ) drug antiporter","Chromosome","P","Inorganic ion transport and metabolism","Metabolism","Phox-liver",0.999204941602324,0.523966415846406,0.446321813845184
"SL1344_1359","cfa","FtsJ-like methyltransferase","Chromosome","M","Cell wall/membrane/envelop biogenesis","Cellular processes and signaling","Phox-liver",0.33153249698758,0.913039576483553,0.777739693927319
"SL1344_1360","ydhC","Sugar (and other) transporter","Chromosome","EGP","Amino acid transport and metabolism;Carbohydrate transport and metabolism;Inorganic ion transport and metabolism","Metabolism","Phox-liver",0.999204941602324,0.268242000433797,0.228492232636086
"SL1344_1361","ydhB","LysR substrate binding domain","Chromosome","K","Transcription","Information storage and processing","Phox-liver",0.941126851011455,0.692143259655382,0.589577167061532
"SL1344_1362","purR","Is the main repressor of the genes involved in the de novo synthesis of purine nucleotides, regulating purB, purC, purEK, purF, purHD, purL, purMN and guaBA expression. PurR is allosterically activated to bind its cognate DNA by binding the purine corepressors, hypoxanthine or guanine, thereby effecting transcription repression","Chromosome","K","Transcription","Information storage and processing","Phox-liver",0.999204941602324,-0.0559063098443055,-0.0476217651751477
"SL1344_1363","sodB","radicals which are normally produced within the cells and which are toxic to biological systems","Chromosome","C","Energy production and conversion","Metabolism","Phox-liver",0.999204941602324,0.0983431655036837,0.0837700636518426
"SL1344_1364","ydhO","NlpC/P60 family","Chromosome","M","Cell wall/membrane/envelop biogenesis","Cellular processes and signaling","Phox-liver",0.999204941602324,0.0981886448816994,0.0836384408565741
"SL1344_1365","ydhD","Glutaredoxin","Chromosome","C","Energy production and conversion","Metabolism","Phox-liver",0.999204941602324,0.141339428254045,0.120394872797875
"SL1344_1368","nemA","NADH:flavin oxidoreductase / NADH oxidase family","Chromosome","C","Energy production and conversion","Metabolism","Phox-liver",0.999204941602324,0.296888340964129,0.252893580277558
"SL1344_1369","ydhM","Bacterial transcriptional repressor C-terminal","Chromosome","K","Transcription","Information storage and processing","Phox-liver",0.999204941602324,0.575452435721848,0.49017831510845
"SL1344_1370","ydhL","Protein of unknown function (DUF1289)","Chromosome","S","Function Unknown","Poorly characterised","Phox-liver",0.993633108324448,-0.00800394945938322,-0.0068178744526334
"SL1344_1371","ydhF","Aldo/keto reductase family","Chromosome","S","Function Unknown","Poorly characterised","Phox-liver",0.0650160888466641,1.34681645309738,1.14723681534423
"SL1344_1372","sodCb","Destroys radicals which are normally produced within the cells and which are toxic to biological systems","Chromosome","P","Inorganic ion transport and metabolism","Metabolism","Phox-liver",0.999204941602324,0.238711194630958,0.203337485286598
"SL1344_1373","SL1344_1373","Fusaric acid resistance protein-like","Chromosome","U"," Intracellular trafficking, secretion, and vesicular transport","Cellular processes and signaling","Phox-liver",0.75446482296339,0.83842690893236,0.714183595463486
"SL1344_1376","slyA","Transcription regulator that can specifically activate or repress expression of target genes","Chromosome","K","Transcription","Information storage and processing","Phox-liver",0.0320634525111347,-1.51267103252984,-1.28851403176133
"SL1344_1377","slyB","Glycine zipper 2TM domain","Chromosome","M","Cell wall/membrane/envelop biogenesis","Cellular processes and signaling","Phox-liver",0.999204941602324,-0.317295693887783,-0.270276844733451
"SL1344_1382","pdxY","Pyridoxal kinase involved in the salvage pathway of pyridoxal 5'-phosphate (PLP). Catalyzes the phosphorylation of pyridoxal to PLP","Chromosome","H","Coenzyme transport and metabolism","Metabolism","Phox-liver",0.999204941602324,0.126048312465797,0.107369689641235
"SL1344_1383","gst","Glutathione S-transferase, C-terminal domain","Chromosome","O","Post-translational modification, protein turnover, and chaperones","Cellular processes and signaling","Phox-liver",0.140552168164215,1.19836114659918,1.02078053939344
"SL1344_1384","tppB","Proton-dependent permease that transports di- and tripeptides","Chromosome","U"," Intracellular trafficking, secretion, and vesicular transport","Cellular processes and signaling","Phox-liver",0.472671773535968,0.649715730626297,0.553436813137052
"SL1344_1386","rnfE","Rnf-Nqr subunit, membrane protein","Chromosome","C","Energy production and conversion","Metabolism","Phox-liver",0.954484232972787,-0.0686486285215238,-0.0584758478274155
"SL1344_1387","rnfG","Part of a membrane complex involved in electron transport. Required to maintain the reduced state of SoxR","Chromosome","C","Energy production and conversion","Metabolism","Phox-liver",0.999204941602324,0.219904168613582,0.187317401343719
"SL1344_1388","rnfD","NQR2, RnfD, RnfE family","Chromosome","C","Energy production and conversion","Metabolism","Phox-liver",0.999204941602324,0.145769226500866,0.124168235991956
"SL1344_1389","rnfC","RnfC Barrel sandwich hybrid domain","Chromosome","C","Energy production and conversion","Metabolism","Phox-liver",0.487382865869314,0.701390880534476,0.59745441796862
"SL1344_1391","rnfA","Part of a membrane complex involved in electron transport. Required to maintain the reduced state of SoxR","Chromosome","C","Energy production and conversion","Metabolism","Phox-liver",0.393152697202256,0.802124744915858,0.683260911870917
"SL1344_1393","ydgT","Haemolysin expression modulating protein","Chromosome","K","Transcription","Information storage and processing","Phox-liver",0.999204941602324,0.433760928423166,0.36948353652832
"SL1344_1394","ydgJ","Oxidoreductase family, C-terminal alpha/beta domain","Chromosome","S","Function Unknown","Poorly characterised","Phox-liver",0.595730527261828,0.55859782075008,0.475821321800568
"SL1344_1395","add","Adenosine/AMP deaminase","Chromosome","F","Nucleotide transport and metabolism","Metabolism","Phox-liver",0.999204941602324,0.400172232841777,0.340872222743328
"SL1344_1396","ydgA","Bacterial protein of unknown function (DUF945)","Chromosome","S","Function Unknown","Poorly characterised","Phox-liver",0.92277007555572,-0.127539791657966,-0.108640152171331
"SL1344_1397","manA","Phosphomannose isomerase type I","Chromosome","G","Carbohydrate transport and metabolism","Metabolism","Phox-liver",0.536510593710364,-0.647196026418243,-0.551290494368366
"SL1344_1398","fumA","Catalyzes the reversible hydration of fumarate to (S)- malate","Chromosome","C","Energy production and conversion","Metabolism","Phox-liver",0.909295377137579,-0.13440248966238,-0.114485892906935
"SL1344_1400","fumC","Involved in the TCA cycle. Catalyzes the stereospecific interconversion of fumarate to L-malate","Chromosome","C","Energy production and conversion","Metabolism","Phox-liver",0.999204941602324,0.118266420587468,0.100740966896339
"SL1344_1401","tus","Trans-acting protein required for termination of DNA replication. Binds to DNA replication terminator sequences (terA to terF) to prevent the passage of replication forks. The termination efficiency will be affected by the affinity of this protein for the terminator sequence","Chromosome","J"," Translation, ribosomal structure and biogenesis","Information storage and processing","Phox-liver",0.999204941602324,0.185658642416545,0.158146590188477
"SL1344_1402","rstB","HAMP (Histidine kinases, Adenylyl cyclases, Methyl binding proteins, Phosphatases) domain","Chromosome","T","Signal transduction mechanisms","Cellular processes and signaling","Phox-liver",0.706424520908628,0.455892185473211,0.388335246276347
"SL1344_1403","SL1344_1403","Amidohydrolase family","Chromosome","S","Function Unknown","Poorly characterised","Phox-liver",0.10142344825255,1.2573309971568,1.07101187076711
"SL1344_1404","ompN","Gram-negative porin","Chromosome","M","Cell wall/membrane/envelop biogenesis","Cellular processes and signaling","Phox-liver",0.999204941602324,-0.528205898026248,-0.44993306319065
"SL1344_1405","rstA","Transcriptional regulatory protein, C terminal","Chromosome","K","Transcription","Information storage and processing","Phox-liver",0.830180295692189,0.241933967167212,0.206082687346291
"SL1344_1406","ydgC","GlpM protein","Chromosome","S","Function Unknown","Poorly characterised","Phox-liver",0.999204941602324,0.224535028749272,0.19126203182559
"SL1344_1407","ydgI","Amino acid permease","Chromosome","E","Amino acid transport and metabolism","Metabolism","Phox-liver",0.215077483458962,1.14787039593575,0.977771822160857
"SL1344_1408","ydgH","Protein of unknown function (DUF1471)","Chromosome","S","Function Unknown","Poorly characterised","Phox-liver",0.999204941602324,0.226600355591019,0.193021305691841
"SL1344_1409","pntA","The transhydrogenation between NADH and NADP is coupled to respiration and ATP hydrolysis and functions as a proton pump across the membrane","Chromosome","C","Energy production and conversion","Metabolism","Phox-liver",0.240799617161173,-1.121511316889,-0.955318795372051
"SL1344_1410","pntB","The transhydrogenation between NADH and NADP is coupled to respiration and ATP hydrolysis and functions as a proton pump across the membrane","Chromosome","C","Energy production and conversion","Metabolism","Phox-liver",0.559749394828734,-0.642522127720725,-0.547309203046412
"SL1344_1411","tqsA","AI-2E family transporter","Chromosome","S","Function Unknown","Poorly characterised","Phox-liver",0.206759089242813,1.11383954613652,0.948783875319742
"SL1344_1414","SL1344_1414","Trypsin","Chromosome","M","Cell wall/membrane/envelop biogenesis","Cellular processes and signaling","Phox-liver",0.999204941602324,0.546929187244487,0.46588181897404
"SL1344_1416","ynfM","Sugar (and other) transporter","Chromosome","EGP","Amino acid transport and metabolism;Carbohydrate transport and metabolism;Inorganic ion transport and metabolism","Metabolism","Phox-liver",0.999204941602324,-0.00911890934419411,-0.00776761264787546
"SL1344_1417","ynfL","LysR substrate binding domain","Chromosome","K","Transcription","Information storage and processing","Phox-liver",0.999204941602324,0.435319765114893,0.370811375104799
"SL1344_1418","mlc","ROK family","Chromosome","GK","Carbohydrate transport and metabolism;Transcription","Metabolism;Information storage and processing","Phox-liver",0.33812430735278,0.92198892131959,0.785362869190363
"SL1344_1419","bioDb","Catalyzes a mechanistically unusual reaction, the ATP- dependent insertion of CO2 between the N7 and N8 nitrogen atoms of 7,8-diaminopelargonic acid (DAPA) to form an ureido ring","Chromosome","H","Coenzyme transport and metabolism","Metabolism","Phox-liver",0.999204941602324,0.163315140538466,0.139114087370967
"SL1344_1420","clcB","Probably acts as an electrical shunt for an outwardly- directed proton pump that is linked to amino acid decarboxylation, as part of the extreme acid resistance (XAR) response","Chromosome","P","Inorganic ion transport and metabolism","Metabolism","Phox-liver",0.999204941602324,0.429490313148884,0.365845767583963
"SL1344_1421","SL1344_1421","Domain in cystathionine beta-synthase and other proteins.","Chromosome","P","Inorganic ion transport and metabolism","Metabolism","Phox-liver",0.609315955286389,0.925154562666888,0.788059406115973
