"locus_tag","gene_name","gene_function","DNA_molecule","COG","description","theme","model","FDR","logFC","zscore"
"SL1344_3546","yhhS","Major Facilitator Superfamily","Chromosome","U"," Intracellular trafficking, secretion, and vesicular transport","Cellular processes and signaling","Phox-liver",0.651241085678185,-0.453055817731038,-0.385919189145331
"SL1344_3547","yhhT","AI-2E family transporter","Chromosome","S","Function Unknown","Poorly characterised","Phox-liver",0.885294818516704,-0.160945205442661,-0.137095343996076
"SL1344_3548","acpT","4'-phosphopantetheinyl transferase superfamily","Chromosome","H","Coenzyme transport and metabolism","Metabolism","Phox-liver",0.914203852414607,0.12199000926298,0.103912771045243
"SL1344_3549","nikR","Transcriptional repressor of the nikABCDE operon. Is active in the presence of excessive concentrations of intracellular nickel","Chromosome","K","Transcription","Information storage and processing","Phox-liver",0.999204941602324,0.078364641928692,0.0667520819448759
"SL1344_3550","yhhJ","ABC-2 family transporter protein","Chromosome","V","Defense mechanisms","Cellular processes and signaling","Phox-liver",0.999204941602324,0.392063507755691,0.333965098967947
"SL1344_3551","yhiH","ABC-2 family transporter protein","Chromosome","V","Defense mechanisms","Cellular processes and signaling","Phox-liver",0.514347391868644,-0.614346561766741,-0.523308867676858
"SL1344_3552","yhiI","Barrel-sandwich domain of CusB or HlyD membrane-fusion","Chromosome","M","Cell wall/membrane/envelop biogenesis","Cellular processes and signaling","Phox-liver",0.483910594830399,-0.639055846794764,-0.544356577184556
"SL1344_3553","yhiN","HI0933-like protein","Chromosome","S","Function Unknown","Poorly characterised","Phox-liver",0.999204941602324,-0.526107829594312,-0.448145899586662
"SL1344_3554","pitA","Phosphate transporter family","Chromosome","P","Inorganic ion transport and metabolism","Metabolism","Phox-liver",0.00691227153458159,-1.90748919880334,-1.62482558681694
"SL1344_3555","uspB","Universal stress protein B (UspB)","Chromosome","S","Function Unknown","Poorly characterised","Phox-liver",0.999204941602324,-0.261882025636535,-0.223074718456406
"SL1344_3557","yhiP","Proton-dependent permease that transports di- and tripeptides","Chromosome","U"," Intracellular trafficking, secretion, and vesicular transport","Cellular processes and signaling","Phox-liver",0.617049535840015,-0.481182190257519,-0.409877620875398
"SL1344_3559","prlC","Peptidase family M3","Chromosome","E","Amino acid transport and metabolism","Metabolism","Phox-liver",0.711344535509739,-0.379170053878981,-0.322982277269945
"SL1344_3560","SL1344_3560","PAP2 superfamily","Chromosome","I","Lipid transport and metabolism","Metabolism","Phox-liver",0.464002045538299,0.725272687643322,0.617797270381217
"SL1344_3561","yhiR","Specifically methylates the adenine in position 2030 of 23S rRNA","Chromosome","H","Coenzyme transport and metabolism","Metabolism","Phox-liver",0.999204941602324,-0.537401720468305,-0.457766191475231
"SL1344_3562","gor","Pyridine nucleotide-disulphide oxidoreductase, dimerisation domain","Chromosome","C","Energy production and conversion","Metabolism","Phox-liver",0.0767708142387183,-1.36145073799955,-1.15970250090026
"SL1344_3563","SL1344_3563","Asparaginase","Chromosome","EJ","Amino acid transport and metabolism; Translation, ribosomal structure and biogenesis","Metabolism;Information storage and processing","Phox-liver",0.27730142546826,-0.963620611939545,-0.820825316990427
"SL1344_3564","SL1344_3564","Responsible for the transport of C4-dicarboxylates from the periplasm across the inner membrane","Chromosome","U"," Intracellular trafficking, secretion, and vesicular transport","Cellular processes and signaling","Phox-liver",0.33036337654604,0.904634061862053,0.77057976073559
"SL1344_3565","SL1344_3565","pfkB family carbohydrate kinase","Chromosome","G","Carbohydrate transport and metabolism","Metabolism","Phox-liver",0.0361569957003953,-1.44057773520888,-1.22710396757927
"SL1344_3566","SL1344_3566","SIS domain","Chromosome","M","Cell wall/membrane/envelop biogenesis","Cellular processes and signaling","Phox-liver",0.943345646353427,-0.0817507301550707,-0.0696363985600846
"SL1344_3567","SL1344_3567","UTRA","Chromosome","K","Transcription","Information storage and processing","Phox-liver",0.872789879307352,-0.210358012449643,-0.179185853966859
"SL1344_3568","treF","Hydrolyzes trehalose to glucose. Could be involved, in cells returning to low osmolarity conditions, in the utilization of the accumulated cytoplasmic trehalose, which was synthesized in response to high osmolarity","Chromosome","G","Carbohydrate transport and metabolism","Metabolism","Phox-liver",0.687487985927322,0.410267391668553,0.349471418154247
"SL1344_3569","SL1344_3569","-","Chromosome","-","no category","no theme","Phox-liver",0.874491053927455,-0.195843679181917,-0.166822344866108
"SL1344_3572","yhjC","LysR substrate binding domain","Chromosome","K","Transcription","Information storage and processing","Phox-liver",0.529395555580168,0.604405889128203,0.514841265730068
"SL1344_3573","yhjD","Virulence factor BrkB","Chromosome","S","Function Unknown","Poorly characterised","Phox-liver",0.999204941602324,-0.299602836767854,-0.255205825211876
"SL1344_3574","yhjE","Sugar (and other) transporter","Chromosome","EGP","Amino acid transport and metabolism;Carbohydrate transport and metabolism;Inorganic ion transport and metabolism","Metabolism","Phox-liver",0.999204941602324,-0.430560374360658,-0.366757260470759
"SL1344_3575","yhjG","AsmA-like C-terminal region","Chromosome","M","Cell wall/membrane/envelop biogenesis","Cellular processes and signaling","Phox-liver",0.552652118115622,0.590987063541412,0.503410925169225
"SL1344_3576","yhjH","EAL domain","Chromosome","T","Signal transduction mechanisms","Cellular processes and signaling","Phox-liver",0.593731183844891,0.533330477536022,0.454298250639356
"SL1344_3577","kdgK","pfkB family carbohydrate kinase","Chromosome","G","Carbohydrate transport and metabolism","Metabolism","Phox-liver",0.999204941602324,0.144966461858489,0.123484430006609
"SL1344_3578","yhjJ","Insulinase (Peptidase family M16)","Chromosome","S","Function Unknown","Poorly characterised","Phox-liver",0.999204941602324,-0.117504775284141,-0.100092186930664
"SL1344_3579","dctA","Responsible for the transport of dicarboxylates such as succinate, fumarate, and malate","Chromosome","U"," Intracellular trafficking, secretion, and vesicular transport","Cellular processes and signaling","Phox-liver",0.915665649141035,-0.122732922083858,-0.104545594424214
"SL1344_3580","yhjK","Gammaproteobacterial periplasmic sensor domain","Chromosome","T","Signal transduction mechanisms","Cellular processes and signaling","Phox-liver",0.195928132971126,-1.10357679982527,-0.94004192658001
"SL1344_3581","yhjL","TPR repeat","Chromosome","O","Post-translational modification, protein turnover, and chaperones","Cellular processes and signaling","Phox-liver",0.471522450785335,-0.730597623409647,-0.62233312405038
"SL1344_3582","bcsC","Belongs to the glycosyl hydrolase 8 (cellulase D) family","Chromosome","G","Carbohydrate transport and metabolism","Metabolism","Phox-liver",0.0433273238510274,-1.44758261090013,-1.23307081722789
"SL1344_3583","yhjN","Binds the cellulose synthase activator, bis-(3'-5') cyclic diguanylic acid (c-di-GMP)","Chromosome","M","Cell wall/membrane/envelop biogenesis","Cellular processes and signaling","Phox-liver",0.352746488667115,-1.04773859652631,-0.89247817549877
"SL1344_3584","bcsA","Cellulose synthase","Chromosome","M","Cell wall/membrane/envelop biogenesis","Cellular processes and signaling","Phox-liver",0.436337513475153,-0.722811682304831,-0.61570095211856
"SL1344_3586","yhjR","Cellulose biosynthesis protein BcsR","Chromosome","S","Function Unknown","Poorly characterised","Phox-liver",0.999204941602324,-0.148038565251574,-0.126101290013766
"SL1344_3587","yhjS","GGDEF I-site like or GIL domain","Chromosome","S","Function Unknown","Poorly characterised","Phox-liver",0.412660134257668,-0.761095974405851,-0.648312039729402
"SL1344_3589","yhjU","Cellulose biosynthesis protein BcsG","Chromosome","S","Function Unknown","Poorly characterised","Phox-liver",0.999204941602324,-0.326208886606654,-0.277869225124877
"SL1344_3591","yhjV","transporter","Chromosome","E","Amino acid transport and metabolism","Metabolism","Phox-liver",0.392073289614719,0.83104587531252,0.707896329307433
"SL1344_3592","dppF","Oligopeptide/dipeptide transporter, C-terminal region","Chromosome","P","Inorganic ion transport and metabolism","Metabolism","Phox-liver",0.989432106229246,0.0144221027754685,0.0122849458964096
"SL1344_3593","dppD","Oligopeptide/dipeptide transporter, C-terminal region","Chromosome","P","Inorganic ion transport and metabolism","Metabolism","Phox-liver",0.914901759052321,-0.123576775400965,-0.105264400308942
"SL1344_3595","dppB","Binding-protein-dependent transport system inner membrane component","Chromosome","P","Inorganic ion transport and metabolism","Metabolism","Phox-liver",0.999204941602324,0.242905397849409,0.206910165388758
"SL1344_3596","dppA","Bacterial extracellular solute-binding proteins, family 5 Middle","Chromosome","E","Amino acid transport and metabolism","Metabolism","Phox-liver",0.98437353427509,-0.68995354464206,-0.587711937636529
"SL1344_3597","SL1344_3597","Permease family","Chromosome","F","Nucleotide transport and metabolism","Metabolism","Phox-liver",0.936413406915876,0.09468241720409,0.0806517878011547
"SL1344_3598","SL1344_3598","Arylsulfotransferase (ASST)","Chromosome","O","Post-translational modification, protein turnover, and chaperones","Cellular processes and signaling","Phox-liver",0.999204941602324,-0.540668139919814,-0.46054857257884
"SL1344_3600","yhjW","Domain of unknown function (DUF1705)","Chromosome","S","Function Unknown","Poorly characterised","Phox-liver",0.999204941602324,0.170951794824023,0.145619094732808
"SL1344_3601","lpfE","Fimbrial protein","Chromosome","NU","Cell motility; Intracellular trafficking, secretion, and vesicular transport","Cellular processes and signaling","Phox-liver",0.363107104651696,-0.826523850889414,-0.704044406585415
"SL1344_3602","lpfD","Fimbrial protein","Chromosome","NU","Cell motility; Intracellular trafficking, secretion, and vesicular transport","Cellular processes and signaling","Phox-liver",0.280220962200647,0.926169385755651,0.788923846408348
"SL1344_3604","lpfC","PapC C-terminal domain","Chromosome","U"," Intracellular trafficking, secretion, and vesicular transport","Cellular processes and signaling","Phox-liver",0.604723019879219,-0.492355200271065,-0.419394944781169
"SL1344_3605","lpfB","Pili assembly chaperone PapD, C-terminal domain","Chromosome","M","Cell wall/membrane/envelop biogenesis","Cellular processes and signaling","Phox-liver",0.112430719348922,-1.27142136466372,-1.0830142399901
"SL1344_3606","lpfA","Fimbrial protein","Chromosome","NU","Cell motility; Intracellular trafficking, secretion, and vesicular transport","Cellular processes and signaling","Phox-liver",0.918706763795784,0.119011844833853,0.101375929542167
"SL1344_3607","yhjY","Autotransporter beta-domain","Chromosome","N","Cell motility","Cellular processes and signaling","Phox-liver",0.354707758571283,0.921536697248507,0.784977658494475
"SL1344_3608","tag","Methyladenine glycosylase","Chromosome","L","Replication, recombination and repair ","Information storage and processing","Phox-liver",0.999204941602324,0.0610411695677997,0.0519957094515731
"SL1344_3610","bisC","Molydopterin dinucleotide binding domain","Chromosome","C","Energy production and conversion","Metabolism","Phox-liver",0.955884133083973,0.067926712427243,0.057860909749518
"SL1344_3611","yiaD","YMGG-like Gly-zipper","Chromosome","M","Cell wall/membrane/envelop biogenesis","Cellular processes and signaling","Phox-liver",0.597764797082654,0.503727843267486,0.429082318812913
"SL1344_3613","yiaF","Protein of unknown function (DUF3053)","Chromosome","S","Function Unknown","Poorly characterised","Phox-liver",0.0748977619387618,-1.30694340055381,-1.11327239969357
"SL1344_3614","yiaG","Helix-turn-helix XRE-family like proteins","Chromosome","K","Transcription","Information storage and processing","Phox-liver",0.50559249532843,0.677809389666141,0.577367379068374
"SL1344_3615","cspA","SMART Cold shock protein","Chromosome","K","Transcription","Information storage and processing","Phox-liver",0.840427454959105,-0.233501824215943,-0.198900071776297
"SL1344_3616","SL1344_3616","-","Chromosome","-","no category","no theme","Phox-liver",0.999204941602324,-0.505623782457582,-0.430697305943142
"SL1344_3617","SL1344_3617","Acetyltransferase (GNAT) domain","Chromosome","K","Transcription","Information storage and processing","Phox-liver",0.820834410335237,0.229523897382832,0.195511618879694
"SL1344_3619","yafP","Acetyltransferase (GNAT) domain","Chromosome","K","Transcription","Information storage and processing","Phox-liver",0.346893816134644,-0.856081350356984,-0.729221891966389
"SL1344_3623","yiaH","Responsible for the incorporation of O-acetyl groups into the enterobacterial common antigen (ECA) trisaccharide repeat units","Chromosome","M","Cell wall/membrane/envelop biogenesis","Cellular processes and signaling","Phox-liver",0.445684472373585,-0.724613934685686,-0.61723613553357
"SL1344_3625","xylB","FGGY family of carbohydrate kinases, N-terminal domain","Chromosome","F","Nucleotide transport and metabolism","Metabolism","Phox-liver",0.999204941602324,-0.0559805038293945,-0.0476849646341203
"SL1344_3626","xylA","Belongs to the xylose isomerase family","Chromosome","G","Carbohydrate transport and metabolism","Metabolism","Phox-liver",0.514347391868644,0.716249311406004,0.610111034150329
"SL1344_3627","xylR","Periplasmic binding protein domain","Chromosome","K","Transcription","Information storage and processing","Phox-liver",0.714775907923083,0.387615037239842,0.330175830477784
"SL1344_3628","bax","Mannosyl-glycoprotein endo-beta-N-acetylglucosaminidase","Chromosome","S","Function Unknown","Poorly characterised","Phox-liver",0.999204941602324,-0.708861587796804,-0.603818069369144
"SL1344_3629","malS","Alpha-amylase domain","Chromosome","M","Cell wall/membrane/envelop biogenesis","Cellular processes and signaling","Phox-liver",0.965806054448025,-0.0493186865994285,-0.0420103369105467
"SL1344_3630","avtA","Aminotransferase class I and II","Chromosome","H","Coenzyme transport and metabolism","Metabolism","Phox-liver",0.388891803018964,-0.78975506422188,-0.67272424738813
"SL1344_3631","ysaA","4Fe-4S dicluster domain","Chromosome","C","Energy production and conversion","Metabolism","Phox-liver",0.920138143399428,0.115527970722824,0.098408317562817
"SL1344_3632","yiaJ","helix_turn_helix isocitrate lyase regulation","Chromosome","K","Transcription","Information storage and processing","Phox-liver",0.379124686468326,0.790597588060064,0.67344192080439
"SL1344_3633","yiaK","Catalyzes the reduction of 2,3-diketo-L-gulonate in the presence of NADH, to form 3-keto-L-gulonate","Chromosome","C","Energy production and conversion","Metabolism","Phox-liver",0.306392403056014,-1.00521489503669,-0.856255900547045
"SL1344_3634","yiaL","Domain of unknown function (DUF386)","Chromosome","G","Carbohydrate transport and metabolism","Metabolism","Phox-liver",0.710075632935708,-0.364482214324298,-0.310470973122858
"SL1344_3635","SL1344_3635","Domain of unknown function (DUF4862)","Chromosome","L","Replication, recombination and repair ","Information storage and processing","Phox-liver",0.999528756987816,-0.000411963588727835,-0.000350916262184784
"SL1344_3636","yiaM","Tripartite ATP-independent periplasmic transporters, DctQ component","Chromosome","G","Carbohydrate transport and metabolism","Metabolism","Phox-liver",0.918152041194435,0.121634253128375,0.10360973306708
"SL1344_3637","yiaN","Tripartite ATP-independent periplasmic transporter, DctM component","Chromosome","G","Carbohydrate transport and metabolism","Metabolism","Phox-liver",0.000642298360638416,-2.03520382303673,-1.7336146637854
"SL1344_3638","yiaO","TIGRFAM TRAP dicarboxylate transporter, DctP subunit","Chromosome","G","Carbohydrate transport and metabolism","Metabolism","Phox-liver",0.673191295627723,-0.420777972674264,-0.358424475902152
"SL1344_3639","lyxK","FGGY family of carbohydrate kinases, N-terminal domain","Chromosome","G","Carbohydrate transport and metabolism","Metabolism","Phox-liver",0.538205259357518,-0.575743435934632,-0.490426193099999
"SL1344_3640","sgbH","Orotidine 5'-phosphate decarboxylase / HUMPS family","Chromosome","G","Carbohydrate transport and metabolism","Metabolism","Phox-liver",0.999204941602324,0.276372774117489,0.235418137710761
"SL1344_3641","sgbU","Xylose isomerase-like TIM barrel","Chromosome","G","Carbohydrate transport and metabolism","Metabolism","Phox-liver",0.985790430331706,-0.0256432398754656,-0.0218432651176635
"SL1344_3643","SL1344_3643","helix_turn_helix, arabinose operon control protein","Chromosome","K","Transcription","Information storage and processing","Phox-liver",0.730831553042737,-0.33790917447009,-0.287835691569647
"SL1344_3644","SL1344_3644","Beta-L-arabinofuranosidase, GH127","Chromosome","S","Function Unknown","Poorly characterised","Phox-liver",0.58238087255877,-0.544944578473578,-0.464191301872912
"SL1344_3645","aldB","Aldehyde dehydrogenase family","Chromosome","C","Energy production and conversion","Metabolism","Phox-liver",0.254004878864198,0.950762484054813,0.809872586459222
"SL1344_3646","SL1344_3646","ROK family","Chromosome","G","Carbohydrate transport and metabolism","Metabolism","Phox-liver",0.752460337369347,-0.313172527869698,-0.266764675097533
"SL1344_3647","selB","Elongation factor SelB, winged helix","Chromosome","J"," Translation, ribosomal structure and biogenesis","Information storage and processing","Phox-liver",0.0774759292010757,-1.38325536986894,-1.17827598681816
"SL1344_3648","selA","Converts seryl-tRNA(Sec) to selenocysteinyl-tRNA(Sec) required for selenoprotein biosynthesis","Chromosome","J"," Translation, ribosomal structure and biogenesis","Information storage and processing","Phox-liver",0.661450539492798,0.419334538840165,0.357194939070178
"SL1344_3649","yibF","Glutathione S-transferase, C-terminal domain","Chromosome","O","Post-translational modification, protein turnover, and chaperones","Cellular processes and signaling","Phox-liver",0.999204941602324,-0.213389923189278,-0.181768477317908
"SL1344_3651","mtlD","Mannitol dehydrogenase C-terminal domain","Chromosome","C","Energy production and conversion","Metabolism","Phox-liver",1.05e-05,-2.48419988243307,-2.11607569483335
"SL1344_3654","yibL","Protein of unknown function (DUF2810)","Chromosome","S","Function Unknown","Poorly characterised","Phox-liver",0.808995234283676,0.274665409311094,0.233963780839329
"SL1344_3656","sadA","YadA-like membrane anchor domain","Chromosome","UW"," Intracellular trafficking, secretion, and vesicular transport;NA","Cellular processes and signaling;NA","Phox-liver",0.497981593728704,-0.631619949460525,-0.538022577360497
"SL1344_3657","lctP","L-lactate permease","Chromosome","U"," Intracellular trafficking, secretion, and vesicular transport","Cellular processes and signaling","Phox-liver",0.902526853943482,0.147256030072188,0.125434715763779
"SL1344_3659","lctD","Catalyzes the conversion of L-lactate to pyruvate. Is coupled to the respiratory chain","Chromosome","H","Coenzyme transport and metabolism","Metabolism","Phox-liver",0.999204941602324,-0.577525778990906,-0.491944417477959
"SL1344_3660","yibK","Methylates the ribose at the nucleotide 34 wobble position in the two leucyl isoacceptors tRNA(Leu)(CmAA) and tRNA(Leu)(cmnm5UmAA). Catalyzes the methyl transfer from S- adenosyl-L-methionine to the 2'-OH of the wobble nucleotide","Chromosome","J"," Translation, ribosomal structure and biogenesis","Information storage and processing","Phox-liver",0.999204941602324,-0.120728423642567,-0.102838135027753
"SL1344_3662","SL1344_3662","Mandelate racemase / muconate lactonizing enzyme, C-terminal domain","Chromosome","M","Cell wall/membrane/envelop biogenesis","Cellular processes and signaling","Phox-liver",0.5989929879902,0.492239483532858,0.419296375668862
"SL1344_3663","SL1344_3663","Major Facilitator Superfamily","Chromosome","G","Carbohydrate transport and metabolism","Metabolism","Phox-liver",0.425815934554787,0.711324611502489,0.605916106904793
"SL1344_3669","yibN","Rhodanese-like domain","Chromosome","P","Inorganic ion transport and metabolism","Metabolism","Phox-liver",0.999204941602324,-0.58835832411332,-0.501171728697487
"SL1344_3670","pmgI","Catalyzes the interconversion of 2-phosphoglycerate and 3-phosphoglycerate","Chromosome","G","Carbohydrate transport and metabolism","Metabolism","Phox-liver",0.862581127589015,-0.197838862035177,-0.168521869116305
"SL1344_3671","yibP","Peptidase family M23","Chromosome","D","Cell cycle control, cell division, chromosome partitioning","Cellular processes and signaling","Phox-liver",0.241949707892063,-1.15668217004908,-0.985277812786425
"SL1344_3672","yigQ","Divergent polysaccharide deacetylase","Chromosome","S","Function Unknown","Poorly characterised","Phox-liver",0.115778084411941,-1.18875385557835,-1.01259691650297
"SL1344_3673","yibD","Glycosyltransferase like family 2","Chromosome","S","Function Unknown","Poorly characterised","Phox-liver",0.209200865318871,-1.12602480349185,-0.959163445461114
"SL1344_3674","tdh","Catalyzes the NAD( )-dependent oxidation of L-threonine to 2-amino-3-ketobutyrate","Chromosome","C","Energy production and conversion","Metabolism","Phox-liver",0.999204941602324,-0.528363013663599,-0.45006689645577
"SL1344_3675","kbl","Catalyzes the cleavage of 2-amino-3-ketobutyrate to glycine and acetyl-CoA","Chromosome","H","Coenzyme transport and metabolism","Metabolism","Phox-liver",0.999204941602324,-0.382716938566733,-0.326003562526901
"SL1344_3676","rfaD","Catalyzes the interconversion between ADP-D-glycero- beta-D-manno-heptose and ADP-L-glycero-beta-D-manno-heptose via an epimerization at carbon 6 of the heptose","Chromosome","F","Nucleotide transport and metabolism","Metabolism","Phox-liver",1.01e-22,-7.0594661902515,-6.01335058798008
"SL1344_3677","rfaF","Glycosyltransferase family 9 (heptosyltransferase)","Chromosome","M","Cell wall/membrane/envelop biogenesis","Cellular processes and signaling","Phox-liver",1.33e-07,-4.4706378764707,-3.80815095343114
"SL1344_3679","rfaL","O-antigen ligase like membrane protein","Chromosome","M","Cell wall/membrane/envelop biogenesis","Cellular processes and signaling","Phox-liver",0.0328496110164098,-1.50338316408882,-1.28060249742634
"SL1344_3680","rfaK","Glycosyl transferases group 1","Chromosome","M","Cell wall/membrane/envelop biogenesis","Cellular processes and signaling","Phox-liver",0.0623298606621984,-1.42864544197565,-1.21693987576322
"SL1344_3681","rfaZ","lipopolysaccharide core region biosynthetic process","Chromosome","S","Function Unknown","Poorly characterised","Phox-liver",0.048069120873623,-1.35949414517217,-1.15803584816592
"SL1344_3683","rfaJ","Glycosyl transferase family 8","Chromosome","M","Cell wall/membrane/envelop biogenesis","Cellular processes and signaling","Phox-liver",0.028383135347524,-1.81006005073958,-1.54183409581658
"SL1344_3684","rfaI","Glycosyl transferase family 8","Chromosome","M","Cell wall/membrane/envelop biogenesis","Cellular processes and signaling","Phox-liver",3.32e-19,-4.81019262061857,-4.09738836393006
"SL1344_3685","rfaB","Glycosyltransferase Family 4","Chromosome","M","Cell wall/membrane/envelop biogenesis","Cellular processes and signaling","Phox-liver",4.52e-08,-2.80853541996411,-2.39234917539883
"SL1344_3687","rfaP","Catalyzes the phosphorylation of heptose(I) of the outer membrane lipopolysaccharide core","Chromosome","F","Nucleotide transport and metabolism","Metabolism","Phox-liver",3.11e-55,-8.5626738578151,-7.29380359504771
"SL1344_3688","rfaG","Glycosyltransferase Family 4","Chromosome","M","Cell wall/membrane/envelop biogenesis","Cellular processes and signaling","Phox-liver",4.57e-52,-8.1527629143105,-6.94463580435176
"SL1344_3689","rfaQ","Glycosyltransferase family 9 (heptosyltransferase)","Chromosome","M","Cell wall/membrane/envelop biogenesis","Cellular processes and signaling","Phox-liver",1.76e-08,-3.06460007451776,-2.61046857699713
"SL1344_3692","mutM","Involved in base excision repair of DNA damaged by oxidation or by mutagenic agents. Acts as DNA glycosylase that recognizes and removes damaged bases. Has a preference for oxidized purines, such as 7,8-dihydro-8-oxoguanine (8-oxoG). Has AP (apurinic apyrimidinic) lyase activity and introduces nicks in the DNA strand. Cleaves the DNA backbone by beta-delta elimination to generate a single-strand break at the site of the removed base with both 3'- and 5'-phosphates","Chromosome","L","Replication, recombination and repair ","Information storage and processing","Phox-liver",0.999204941602324,-0.253656368877892,-0.216067990670896
"SL1344_3695","radC","RadC-like JAB domain","Chromosome","E","Amino acid transport and metabolism","Metabolism","Phox-liver",0.579935200232491,0.569364286009299,0.484992345281974
"SL1344_3699","pyrE","Catalyzes the transfer of a ribosyl phosphate group from 5-phosphoribose 1-diphosphate to orotate, leading to the formation of orotidine monophosphate (OMP)","Chromosome","F","Nucleotide transport and metabolism","Metabolism","Phox-liver",0.132667734419536,-1.19328440912823,-1.01645610445272
"SL1344_3700","rph","Phosphorolytic exoribonuclease that removes nucleotide residues following the -CCA terminus of tRNA and adds nucleotides to the ends of RNA molecules by using nucleoside diphosphates as substrates","Chromosome","J"," Translation, ribosomal structure and biogenesis","Information storage and processing","Phox-liver",0.712630516131187,-0.879390708043764,-0.749077124072294
