"locus_tag","Molecule","FDR","logFC","gene_name","genefunc","COG","description","theme"
"SL1344_3593","Chromosome",0.803904007975201,0.460020063219319,"dppD","Oligopeptide/dipeptide transporter, C-terminal region","P","Inorganic ion transport and metabolism","Metabolism"
"SL1344_3595","Chromosome",0.318078372019813,-0.916604053150254,"dppB","Binding-protein-dependent transport system inner membrane component","P","Inorganic ion transport and metabolism","Metabolism"
"SL1344_3596","Chromosome",0.481490293759877,0.805942306717158,"dppA","Bacterial extracellular solute-binding proteins, family 5 Middle","E","Amino acid transport and metabolism","Metabolism"
"SL1344_3597","Chromosome",0.78104792406561,-0.706650067829274,"SL1344_3597","Permease family","F","Nucleotide transport and metabolism","Metabolism"
"SL1344_3598","Chromosome",1,0.00929093386029678,"SL1344_3598","Arylsulfotransferase (ASST)","O","Post-translational modification, protein turnover, and chaperones","Cellular processes and signaling"
"SL1344_3600","Chromosome",0.700939140673532,-0.509232690268527,"yhjW","Domain of unknown function (DUF1705)","S","Function Unknown","Poorly characterised"
"SL1344_3601","Chromosome",0.635951759544991,0.93421515315819,"lpfE","Fimbrial protein","NU","Cell motility; Intracellular trafficking, secretion, and vesicular transport","Cellular processes and signaling"
"SL1344_3602","Chromosome",0.783092638328012,0.456530092244578,"lpfD","Fimbrial protein","NU","Cell motility; Intracellular trafficking, secretion, and vesicular transport","Cellular processes and signaling"
"SL1344_3604","Chromosome",0.400049297709762,-0.829653672083659,"lpfC","PapC C-terminal domain","U"," Intracellular trafficking, secretion, and vesicular transport","Cellular processes and signaling"
"SL1344_3605","Chromosome",0.0112375517449376,-1.68843167334793,"lpfB","Pili assembly chaperone PapD, C-terminal domain","M","Cell wall/membrane/envelop biogenesis","Cellular processes and signaling"
"SL1344_3606","Chromosome",0.746294876009232,0.518962043378596,"lpfA","Fimbrial protein","NU","Cell motility; Intracellular trafficking, secretion, and vesicular transport","Cellular processes and signaling"
"SL1344_3607","Chromosome",0.976641667221217,0.0996290908758981,"yhjY","Autotransporter beta-domain","N","Cell motility","Cellular processes and signaling"
"SL1344_3608","Chromosome",0.492716853966853,-0.861605268611893,"tag","Methyladenine glycosylase","L","Replication, recombination and repair ","Information storage and processing"
"SL1344_3610","Chromosome",0.0822979384715699,-1.25105712931172,"bisC","Molydopterin dinucleotide binding domain","C","Energy production and conversion","Metabolism"
"SL1344_3611","Chromosome",0.13973541990949,1.24649743153325,"yiaD","YMGG-like Gly-zipper","M","Cell wall/membrane/envelop biogenesis","Cellular processes and signaling"
"SL1344_3613","Chromosome",0.203024163569838,-1.05824933207409,"yiaF","Protein of unknown function (DUF3053)","S","Function Unknown","Poorly characterised"
"SL1344_3614","Chromosome",0.707201778926201,-0.502269992537968,"yiaG","Helix-turn-helix XRE-family like proteins","K","Transcription","Information storage and processing"
"SL1344_3615","Chromosome",0.735000665123995,-0.5428371249107,"cspA","SMART Cold shock protein","K","Transcription","Information storage and processing"
"SL1344_3616","Chromosome",0.528127669841654,0.75014947418543,"SL1344_3616","-","-","no category","no theme"
"SL1344_3617","Chromosome",0.409012955810051,-0.866779234936215,"SL1344_3617","Acetyltransferase (GNAT) domain","K","Transcription","Information storage and processing"
"SL1344_3619","Chromosome",0.962686502919752,0.211966041578619,"yafP","Acetyltransferase (GNAT) domain","K","Transcription","Information storage and processing"
"SL1344_3623","Chromosome",0.336672183903315,-0.870237262722998,"yiaH","Responsible for the incorporation of O-acetyl groups into the enterobacterial common antigen (ECA) trisaccharide repeat units","M","Cell wall/membrane/envelop biogenesis","Cellular processes and signaling"
"SL1344_3625","Chromosome",0.139776865983945,-1.14342799299086,"xylB","FGGY family of carbohydrate kinases, N-terminal domain","F","Nucleotide transport and metabolism","Metabolism"
"SL1344_3626","Chromosome",0.140098509355218,-1.18126641365997,"xylA","Belongs to the xylose isomerase family","G","Carbohydrate transport and metabolism","Metabolism"
"SL1344_3627","Chromosome",0.649624123440988,0.616746530326053,"xylR","Periplasmic binding protein domain","K","Transcription","Information storage and processing"
"SL1344_3628","Chromosome",0.491821599422781,-0.757536579656986,"bax","Mannosyl-glycoprotein endo-beta-N-acetylglucosaminidase","S","Function Unknown","Poorly characterised"
"SL1344_3629","Chromosome",0.511456492612392,0.770987126792576,"malS","Alpha-amylase domain","M","Cell wall/membrane/envelop biogenesis","Cellular processes and signaling"
"SL1344_3630","Chromosome",0.709433547048885,0.594838326369421,"avtA","Aminotransferase class I and II","H","Coenzyme transport and metabolism","Metabolism"
"SL1344_3631","Chromosome",0.858069932730528,-0.30544172619529,"ysaA","4Fe-4S dicluster domain","C","Energy production and conversion","Metabolism"
"SL1344_3632","Chromosome",0.452672742497876,-0.75536695505152,"yiaJ","helix_turn_helix isocitrate lyase regulation","K","Transcription","Information storage and processing"
"SL1344_3633","Chromosome",0.0963092580181413,-1.24358761767961,"yiaK","Catalyzes the reduction of 2,3-diketo-L-gulonate in the presence of NADH, to form 3-keto-L-gulonate","C","Energy production and conversion","Metabolism"
"SL1344_3634","Chromosome",0.746294876009232,0.522762812844522,"yiaL","Domain of unknown function (DUF386)","G","Carbohydrate transport and metabolism","Metabolism"
"SL1344_3635","Chromosome",1,0.028814124779284,"SL1344_3635","Domain of unknown function (DUF4862)","L","Replication, recombination and repair ","Information storage and processing"
"SL1344_3636","Chromosome",0.628488789292716,0.670597857218791,"yiaM","Tripartite ATP-independent periplasmic transporters, DctQ component","G","Carbohydrate transport and metabolism","Metabolism"
"SL1344_3637","Chromosome",3.17e-13,-4.15298093446007,"yiaN","Tripartite ATP-independent periplasmic transporter, DctM component","G","Carbohydrate transport and metabolism","Metabolism"
"SL1344_3638","Chromosome",0.955154696688144,-0.127037339843937,"yiaO","TIGRFAM TRAP dicarboxylate transporter, DctP subunit","G","Carbohydrate transport and metabolism","Metabolism"
"SL1344_3639","Chromosome",0.187169098278209,-1.07114767564514,"lyxK","FGGY family of carbohydrate kinases, N-terminal domain","G","Carbohydrate transport and metabolism","Metabolism"
"SL1344_3640","Chromosome",0.567508460692913,-0.997302731727648,"sgbH","Orotidine 5'-phosphate decarboxylase / HUMPS family","G","Carbohydrate transport and metabolism","Metabolism"
"SL1344_3641","Chromosome",0.177796947773253,1.18520397488414,"sgbU","Xylose isomerase-like TIM barrel","G","Carbohydrate transport and metabolism","Metabolism"
"SL1344_3642","Chromosome",0.917196047890508,-0.215359852196144,"sgbE","Class II Aldolase and Adducin N-terminal domain","G","Carbohydrate transport and metabolism","Metabolism"
"SL1344_3643","Chromosome",0.663459185148836,0.607491239612374,"SL1344_3643","helix_turn_helix, arabinose operon control protein","K","Transcription","Information storage and processing"
"SL1344_3644","Chromosome",0.619827388764014,-0.683363509862896,"SL1344_3644","Beta-L-arabinofuranosidase, GH127","S","Function Unknown","Poorly characterised"
"SL1344_3645","Chromosome",0.281929481886307,-1.03032593650116,"aldB","Aldehyde dehydrogenase family","C","Energy production and conversion","Metabolism"
"SL1344_3646","Chromosome",0.941307167953919,0.195925705588006,"SL1344_3646","ROK family","G","Carbohydrate transport and metabolism","Metabolism"
"SL1344_3647","Chromosome",0.000133438736478754,-2.25654945503092,"selB","Elongation factor SelB, winged helix","J"," Translation, ribosomal structure and biogenesis","Information storage and processing"
"SL1344_3648","Chromosome",0.179890306809251,-1.09450687740312,"selA","Converts seryl-tRNA(Sec) to selenocysteinyl-tRNA(Sec) required for selenoprotein biosynthesis","J"," Translation, ribosomal structure and biogenesis","Information storage and processing"
"SL1344_3649","Chromosome",0.926447225011714,0.430218409325219,"yibF","Glutathione S-transferase, C-terminal domain","O","Post-translational modification, protein turnover, and chaperones","Cellular processes and signaling"
"SL1344_3651","Chromosome",6.72e-19,-4.90864323592565,"mtlD","Mannitol dehydrogenase C-terminal domain","C","Energy production and conversion","Metabolism"
"SL1344_3654","Chromosome",0.881458350270993,0.31399968739492,"yibL","Protein of unknown function (DUF2810)","S","Function Unknown","Poorly characterised"
"SL1344_3656","Chromosome",0.0791993469586993,1.75540390086275,"sadA","YadA-like membrane anchor domain","UW"," Intracellular trafficking, secretion, and vesicular transport;NA","Cellular processes and signaling;NA"
"SL1344_3657","Chromosome",0.23919198810911,-1.15985911776508,"lctP","L-lactate permease","U"," Intracellular trafficking, secretion, and vesicular transport","Cellular processes and signaling"
"SL1344_3659","Chromosome",0.572412284189212,0.708162222747074,"lctD","Catalyzes the conversion of L-lactate to pyruvate. Is coupled to the respiratory chain","H","Coenzyme transport and metabolism","Metabolism"
"SL1344_3660","Chromosome",7.68e-05,-2.53901586797638,"yibK","Methylates the ribose at the nucleotide 34 wobble position in the two leucyl isoacceptors tRNA(Leu)(CmAA) and tRNA(Leu)(cmnm5UmAA). Catalyzes the methyl transfer from S- adenosyl-L-methionine to the 2'-OH of the wobble nucleotide","J"," Translation, ribosomal structure and biogenesis","Information storage and processing"
"SL1344_3662","Chromosome",0.730087779507364,-0.465125379768276,"SL1344_3662","Mandelate racemase / muconate lactonizing enzyme, C-terminal domain","M","Cell wall/membrane/envelop biogenesis","Cellular processes and signaling"
"SL1344_3663","Chromosome",0.487307275531321,-0.73625750197559,"SL1344_3663","Major Facilitator Superfamily","G","Carbohydrate transport and metabolism","Metabolism"
"SL1344_3665","Chromosome",1.33e-33,-7.74164539764949,"cysE","Serine acetyltransferase, N-terminal","E","Amino acid transport and metabolism","Metabolism"
"SL1344_3666","Chromosome",6.35e-20,-5.44949511062166,"gpsA","NAD-dependent glycerol-3-phosphate dehydrogenase N-terminus","I","Lipid transport and metabolism","Metabolism"
"SL1344_3669","Chromosome",0.123001757960464,-1.15437327801388,"yibN","Rhodanese-like domain","P","Inorganic ion transport and metabolism","Metabolism"
"SL1344_3670","Chromosome",0.00800507905479299,-1.65745414423795,"pmgI","Catalyzes the interconversion of 2-phosphoglycerate and 3-phosphoglycerate","G","Carbohydrate transport and metabolism","Metabolism"
"SL1344_3671","Chromosome",7.1e-14,-3.90044312674748,"yibP","Peptidase family M23","D","Cell cycle control, cell division, chromosome partitioning","Cellular processes and signaling"
"SL1344_3672","Chromosome",0.130406929487271,-1.13116579411357,"yigQ","Divergent polysaccharide deacetylase","S","Function Unknown","Poorly characterised"
"SL1344_3673","Chromosome",0.569565826877482,0.696724989850381,"yibD","Glycosyltransferase like family 2","S","Function Unknown","Poorly characterised"
"SL1344_3674","Chromosome",0.634199848083226,-0.654691131932178,"tdh","Catalyzes the NAD( )-dependent oxidation of L-threonine to 2-amino-3-ketobutyrate","C","Energy production and conversion","Metabolism"
"SL1344_3675","Chromosome",0.455873492435105,-0.774624199972841,"kbl","Catalyzes the cleavage of 2-amino-3-ketobutyrate to glycine and acetyl-CoA","H","Coenzyme transport and metabolism","Metabolism"
"SL1344_3676","Chromosome",1.2e-43,-15,"rfaD","Catalyzes the interconversion between ADP-D-glycero- beta-D-manno-heptose and ADP-L-glycero-beta-D-manno-heptose via an epimerization at carbon 6 of the heptose","F","Nucleotide transport and metabolism","Metabolism"
"SL1344_3677","Chromosome",1.84e-41,-15,"rfaF","Glycosyltransferase family 9 (heptosyltransferase)","M","Cell wall/membrane/envelop biogenesis","Cellular processes and signaling"
"SL1344_3679","Chromosome",0.0563057793333368,1.46558122186097,"rfaL","O-antigen ligase like membrane protein","M","Cell wall/membrane/envelop biogenesis","Cellular processes and signaling"
"SL1344_3680","Chromosome",2.74e-12,-3.87598397685899,"rfaK","Glycosyl transferases group 1","M","Cell wall/membrane/envelop biogenesis","Cellular processes and signaling"
"SL1344_3681","Chromosome",0.404070284840216,0.909681113732458,"rfaZ","lipopolysaccharide core region biosynthetic process","S","Function Unknown","Poorly characterised"
"SL1344_3683","Chromosome",0.0831126044512364,-1.43990531119958,"rfaJ","Glycosyl transferase family 8","M","Cell wall/membrane/envelop biogenesis","Cellular processes and signaling"
"SL1344_3684","Chromosome",1.39e-13,-4.58443942453137,"rfaI","Glycosyl transferase family 8","M","Cell wall/membrane/envelop biogenesis","Cellular processes and signaling"
"SL1344_3685","Chromosome",1.52e-11,-3.55843123436537,"rfaB","Glycosyltransferase Family 4","M","Cell wall/membrane/envelop biogenesis","Cellular processes and signaling"
"SL1344_3687","Chromosome",8.42e-45,-15,"rfaP","Catalyzes the phosphorylation of heptose(I) of the outer membrane lipopolysaccharide core","F","Nucleotide transport and metabolism","Metabolism"
"SL1344_3688","Chromosome",6.7e-50,-15,"rfaG","Glycosyltransferase Family 4","M","Cell wall/membrane/envelop biogenesis","Cellular processes and signaling"
"SL1344_3689","Chromosome",1.83e-13,-4.01226182929873,"rfaQ","Glycosyltransferase family 9 (heptosyltransferase)","M","Cell wall/membrane/envelop biogenesis","Cellular processes and signaling"
"SL1344_3692","Chromosome",0.592191743194985,-1.17149269096154,"mutM","Involved in base excision repair of DNA damaged by oxidation or by mutagenic agents. Acts as DNA glycosylase that recognizes and removes damaged bases. Has a preference for oxidized purines, such as 7,8-dihydro-8-oxoguanine (8-oxoG). Has AP (apurinic apyrimidinic) lyase activity and introduces nicks in the DNA strand. Cleaves the DNA backbone by beta-delta elimination to generate a single-strand break at the site of the removed base with both 3'- and 5'-phosphates","L","Replication, recombination and repair ","Information storage and processing"
"SL1344_3695","Chromosome",0.838762228092807,-0.334156908650849,"radC","RadC-like JAB domain","E","Amino acid transport and metabolism","Metabolism"
"SL1344_3699","Chromosome",3.2e-11,-3.83551240013191,"pyrE","Catalyzes the transfer of a ribosyl phosphate group from 5-phosphoribose 1-diphosphate to orotate, leading to the formation of orotidine monophosphate (OMP)","F","Nucleotide transport and metabolism","Metabolism"
"SL1344_3700","Chromosome",0.00597466445095377,-1.7614315134584,"rph","Phosphorolytic exoribonuclease that removes nucleotide residues following the -CCA terminus of tRNA and adds nucleotides to the ends of RNA molecules by using nucleoside diphosphates as substrates","J"," Translation, ribosomal structure and biogenesis","Information storage and processing"
"SL1344_3701","Chromosome",0.663062153776689,-0.641440286377182,"yicC","Domain of unknown function (DUF1732)","S","Function Unknown","Poorly characterised"
"SL1344_3702","Chromosome",0.582164319221092,0.71135699431731,"SL1344_3702","LysR substrate binding domain","K","Transcription","Information storage and processing"
"SL1344_3703","Chromosome",0.685063352361196,0.579752816204766,"SL1344_3703","Metallo-beta-lactamase superfamily","S","Function Unknown","Poorly characterised"
"SL1344_3704","Chromosome",0.301156408641027,-0.94192379973128,"SL1344_3704","UPF0126 domain","S","Function Unknown","Poorly characterised"
"SL1344_3705","Chromosome",0.183956852679218,-1.11181548203365,"ligB","catalyzes the formation of phosphodiester linkages between 5'-phosphoryl and 3'-hydroxyl groups in double-stranded DNA using NAD as a coenzyme and as the energy source for the reaction","H","Coenzyme transport and metabolism","Metabolism"
"SL1344_3707","Chromosome",1.11e-30,-8.25708375735071,"rpoZ","Promotes RNA polymerase assembly. Latches the N- and C- terminal regions of the beta' subunit thereby facilitating its interaction with the beta and alpha subunits","K","Transcription","Information storage and processing"
"SL1344_3708","Chromosome",0.363931210526624,-0.860361134676142,"spoT","In eubacteria ppGpp (guanosine 3'-diphosphate 5-' diphosphate) is a mediator of the stringent response that coordinates a variety of cellular activities in response to changes in nutritional abundance","KT","Transcription;Signal transduction mechanisms","Information storage and processing;Cellular processes and signaling"
"SL1344_3709","Chromosome",3.71e-06,-2.49896011914635,"spoU","Catalyzes the 2'-O methylation of guanosine at position 18 in tRNA","J"," Translation, ribosomal structure and biogenesis","Information storage and processing"
"SL1344_3710","Chromosome",9.08e-20,-5.28627516740605,"recG","Critical role in recombination and DNA repair. Helps process Holliday junction intermediates to mature products by catalyzing branch migration. Has a DNA unwinding activity characteristic of a DNA helicase with a 3'- to 5'- polarity. Unwinds branched duplex DNA (Y-DNA)","L","Replication, recombination and repair ","Information storage and processing"
"SL1344_3711","Chromosome",0.490127376133494,-0.848423915269779,"SL1344_3711","-","-","no category","no theme"
"SL1344_3712","Chromosome",0.0929337951898592,-1.26650146092015,"gltS","Catalyzes the sodium-dependent transport of glutamate","P","Inorganic ion transport and metabolism","Metabolism"
"SL1344_3713","Chromosome",0.354533180125299,-0.845402045908037,"yicE","Permease family","F","Nucleotide transport and metabolism","Metabolism"
"SL1344_3714","Chromosome",0.265531130747047,1.04057708752653,"yicH","AsmA family","M","Cell wall/membrane/envelop biogenesis","Cellular processes and signaling"
"SL1344_3715","Chromosome",0.131776703309927,-1.18326908386873,"yicI","Galactose mutarotase-like","G","Carbohydrate transport and metabolism","Metabolism"
"SL1344_3716","Chromosome",7.9e-05,-2.23993328049032,"yicJ","MFS/sugar transport protein","G","Carbohydrate transport and metabolism","Metabolism"
"SL1344_3717","Chromosome",0.828592602121249,0.498226699518851,"SL1344_3717","-","-","no category","no theme"
"SL1344_3718","Chromosome",0.435162302372574,-0.768546636359756,"sugR","AAA ATPase domain","S","Function Unknown","Poorly characterised"
"SL1344_3723","Chromosome",0.292956077529171,1.02863272761747,"misL","Autotransporter beta-domain","MU","Cell wall/membrane/envelop biogenesis; Intracellular trafficking, secretion, and vesicular transport","Cellular processes and signaling"
"SL1344_3724","Chromosome",0.160346419135093,-1.07109980932589,"fidL","-","-","no category","no theme"
"SL1344_3725","Chromosome",0.687220255258636,-0.519930785954889,"marT","Transcriptional regulatory protein, C terminal","K","Transcription","Information storage and processing"
"SL1344_3726","Chromosome",0.210235401542511,1.22026995511048,"slsA","Isochorismatase family","Q","Secondary metabolites biosynthesis, transport, and catabolism","Metabolism"
"SL1344_3727","Chromosome",0.923064806454552,-0.256210480168942,"cigR","response to cobalt ion","S","Function Unknown","Poorly characterised"
"SL1344_3728","Chromosome",0.596521125850349,0.685982071561475,"mgtB","Cation transporter/ATPase, N-terminus","P","Inorganic ion transport and metabolism","Metabolism"
"SL1344_3730","Chromosome",0.841378144834621,-0.340114639429345,"yicL","EamA-like transporter family","EG","Amino acid transport and metabolism;Carbohydrate transport and metabolism","Metabolism"
"SL1344_3732","Chromosome",0.758176163476917,-0.444877472240476,"SL1344_3732","Pfam:DUF1341","S","Function Unknown","Poorly characterised"
"SL1344_3733","Chromosome",0.105781149712357,-1.43663570596759,"SL1344_3733","L-seryl-tRNA selenium transferase","H","Coenzyme transport and metabolism","Metabolism"
"SL1344_3734","Chromosome",0.942126190463283,-0.157047695586823,"SL1344_3734","PTS system mannose/fructose/sorbose family IID component","G","Carbohydrate transport and metabolism","Metabolism"
"SL1344_3735","Chromosome",0.812813878082686,-0.593783452353888,"SL1344_3735","PTS system sorbose-specific iic component","G","Carbohydrate transport and metabolism","Metabolism"
"SL1344_3738","Chromosome",0.423038573760569,-0.776668847419336,"SL1344_3738","PRD domain","K","Transcription","Information storage and processing"
"SL1344_3740","Chromosome",0.485392144696738,-0.73624412848953,"SL1344_3740","Glycosyl hydrolase family 1","G","Carbohydrate transport and metabolism","Metabolism"
"SL1344_3741","Chromosome",0.573524865759783,-0.638642936392491,"nepI","Involved in the efflux of purine ribonucleosides, such as guanosine, adenosine and especially inosine. Involved in the resistance to 6-mercaptopurine","U"," Intracellular trafficking, secretion, and vesicular transport","Cellular processes and signaling"
"SL1344_3743","Chromosome",0.365682658898568,0.922775422884447,"SL1344_3743","RelE family toxin-antitoxin system","S","Function Unknown","Poorly characterised"
"SL1344_3744","Chromosome",0.0425940838454847,1.50729841236741,"SL1344_3744","Helix-turn-helix domain","K","Transcription","Information storage and processing"
"SL1344_3745","Chromosome",0.580878228840017,0.701764121475111,"SL1344_3745","PTS HPr component phosphorylation site","G","Carbohydrate transport and metabolism","Metabolism"
"SL1344_3746","Chromosome",0.338161512921309,-0.88896255184552,"SL1344_3746","Catalytic subunit of the tagatose-1,6-bisphosphate aldolase GatYZ, which catalyzes the reversible aldol condensation of dihydroxyacetone phosphate (DHAP or glycerone-phosphate) with glyceraldehyde 3-phosphate (G3P) to produce tagatose 1,6- bisphosphate (TBP). Requires GatZ subunit for full activity and stability. Is involved in the catabolism of galactitol","F","Nucleotide transport and metabolism","Metabolism"
"SL1344_3747","Chromosome",0.699880338985682,-0.502084822060864,"SL1344_3747","FGGY family of carbohydrate kinases, N-terminal domain","G","Carbohydrate transport and metabolism","Metabolism"
"SL1344_3748","Chromosome",0.00279735086723254,-2.07907411754466,"SL1344_3748","PTS system sugar-specific permease component","G","Carbohydrate transport and metabolism","Metabolism"
"SL1344_3749","Chromosome",0.490970806267962,0.964195437783387,"SL1344_3749","PTS system, Lactose/Cellobiose specific IIB subunit","G","Carbohydrate transport and metabolism","Metabolism"
"SL1344_3750","Chromosome",0.0754803717703486,1.38441097188885,"SL1344_3750","Phosphoenolpyruvate-dependent sugar phosphotransferase system, EIIA 2","G","Carbohydrate transport and metabolism","Metabolism"
"SL1344_3751","Chromosome",0.707201778926201,-0.491445968766149,"SL1344_3751","UTRA domain","K","Transcription","Information storage and processing"
"SL1344_3752","Chromosome",1,0.0328276763490931,"yicN","Protein of unknown function (DUF1198)","S","Function Unknown","Poorly characterised"
"SL1344_3753","Chromosome",0.786984526692265,0.465199544618443,"uhpT","Major Facilitator Superfamily","G","Carbohydrate transport and metabolism","Metabolism"
"SL1344_3755","Chromosome",0.601410055030115,0.78091550333292,"uhpB","Histidine kinase","T","Signal transduction mechanisms","Cellular processes and signaling"
"SL1344_3756","Chromosome",0.195360850891756,-1.04170706811584,"uhpA","Bacterial regulatory proteins, luxR family","K","Transcription","Information storage and processing"
"SL1344_3757","Chromosome",0.490127376133494,1.88750595818866,"SL1344_3757","Domain of unknown function (DUF4432)","S","Function Unknown","Poorly characterised"
"SL1344_3758","Chromosome",0.333722626399408,-0.90930516125889,"SL1344_3758","Major Facilitator Superfamily","G","Carbohydrate transport and metabolism","Metabolism"
"SL1344_3759","Chromosome",0.87548487708398,-0.278257182101522,"SL1344_3759","Catalyzes the phosphorylation of ribose at O-5 in a reaction requiring ATP and magnesium. The resulting D-ribose-5- phosphate can then be used either for sythesis of nucleotides, histidine, and tryptophan, or as a component of the pentose phosphate pathway","H","Coenzyme transport and metabolism","Metabolism"
"SL1344_3760","Chromosome",0.0553200583664694,-1.3391240462385,"SL1344_3760","DeoR C terminal sensor domain","K","Transcription","Information storage and processing"
"SL1344_3761","Chromosome",0.919626376702981,-0.198947078964608,"ilvN","ACT domain","E","Amino acid transport and metabolism","Metabolism"
"SL1344_3762","Chromosome",0.117609138243442,-1.28041597889875,"ilvB","Thiamine pyrophosphate enzyme, central domain","H","Coenzyme transport and metabolism","Metabolism"
"SL1344_3765","Chromosome",0.549594140853468,0.759052963005914,"SL1344_3765","EamA-like transporter family","EG","Amino acid transport and metabolism;Carbohydrate transport and metabolism","Metabolism"
"SL1344_3766","Chromosome",0.559566537691666,0.749658803977255,"emrD","Major Facilitator Superfamily","EGP","Amino acid transport and metabolism;Carbohydrate transport and metabolism;Inorganic ion transport and metabolism","Metabolism"
"SL1344_3767","Chromosome",0.0807568947753805,1.37633451972421,"SL1344_3767","Cellulase (glycosyl hydrolase family 5)","G","Carbohydrate transport and metabolism","Metabolism"
"SL1344_3768","Chromosome",0.403989494724995,0.881981612289093,"dsdC","LysR substrate binding domain","K","Transcription","Information storage and processing"
"SL1344_3769","Chromosome",0.541822726009652,-0.789965279518899,"dsdX","GntP family permease","EG","Amino acid transport and metabolism;Carbohydrate transport and metabolism","Metabolism"
