"locus_tag","Molecule","FDR","logFC","gene_name","genefunc","COG","description","theme"
"SL1344_2397","Chromosome",0.855394504600318,-0.313345433671238,"SL1344_2397","-","-","no category","no theme"
"SL1344_2398","Chromosome",0.556365257634925,0.768705248473137,"pdxK","B6-vitamer kinase involved in the salvage pathway of pyridoxal 5'-phosphate (PLP). Catalyzes the phosphorylation of pyridoxine (PN), pyridoxal (PL), and pyridoxamine (PM), forming their respective 5'-phosphorylated esters, i.e. PNP, PLP and PMP","H","Coenzyme transport and metabolism","Metabolism"
"SL1344_2399","Chromosome",0.747120929887863,-0.798061585943526,"ptsJ","helix_turn_helix gluconate operon transcriptional repressor","K","Transcription","Information storage and processing"
"SL1344_2401","Chromosome",0.356849529619179,0.942889019994842,"yfeK","Family of unknown function (DUF5329)","S","Function Unknown","Poorly characterised"
"SL1344_2402","Chromosome",0.235380270476324,1.29542895599037,"yfeL","Transglycosylase","M","Cell wall/membrane/envelop biogenesis","Cellular processes and signaling"
"SL1344_2403","Chromosome",0.890611523694052,0.344996092841799,"cysM","Pyridoxal-phosphate dependent enzyme","E","Amino acid transport and metabolism","Metabolism"
"SL1344_2404","Chromosome",0.971824034049318,0.221543429084806,"cysA","Part of the ABC transporter complex CysAWTP involved in sulfate thiosulfate import. Responsible for energy coupling to the transport system","P","Inorganic ion transport and metabolism","Metabolism"
"SL1344_2405","Chromosome",0.954776963760801,-0.131885150548566,"cysW","Binding-protein-dependent transport system inner membrane component","P","Inorganic ion transport and metabolism","Metabolism"
"SL1344_2407","Chromosome",0.789043198209899,0.641375695123052,"cysP","Bacterial extracellular solute-binding protein","P","Inorganic ion transport and metabolism","Metabolism"
"SL1344_2408","Chromosome",0.331706359966633,-0.910120629224222,"ucpA","KR domain","IQ","Lipid transport and metabolism;Secondary metabolites biosynthesis, transport, and catabolism","Metabolism"
"SL1344_2409","Chromosome",0.0859524057587564,-1.33970650557205,"SL1344_2409","Dyp-type peroxidase family","P","Inorganic ion transport and metabolism","Metabolism"
"SL1344_2410","Chromosome",0.646753128288663,-0.576376163591009,"yfeY","Protein of unknown function (DUF1131)","M","Cell wall/membrane/envelop biogenesis","Cellular processes and signaling"
"SL1344_2411","Chromosome",0.567245072333934,0.708168382298637,"yfeZ","Protein of unknown function (DUF2919)","S","Function Unknown","Poorly characterised"
"SL1344_2414","Chromosome",0.399673549214438,0.897239919422556,"hemF","Involved in the heme biosynthesis. Catalyzes the aerobic oxidative decarboxylation of propionate groups of rings A and B of coproporphyrinogen-III to yield the vinyl groups in protoporphyrinogen-IX","H","Coenzyme transport and metabolism","Metabolism"
"SL1344_2415","Chromosome",0.962704553728378,-0.107878796893285,"SL1344_2415","-","-","no category","no theme"
"SL1344_2416","Chromosome",0.408272891328262,0.870789430234609,"SL1344_2416","Domain of unknown function (DUF1963)","S","Function Unknown","Poorly characterised"
"SL1344_2417","Chromosome",0.490127376133494,-0.73253587793628,"eutR","helix_turn_helix, arabinose operon control protein","K","Transcription","Information storage and processing"
"SL1344_2420","Chromosome",1,0.0376333649104812,"eutC","Ethanolamine ammonia-lyase light chain (EutC)","E","Amino acid transport and metabolism","Metabolism"
"SL1344_2422","Chromosome",0.890611523694052,-0.262672049797587,"eutA","Ethanolamine utilisation protein EutA","E","Amino acid transport and metabolism","Metabolism"
"SL1344_2423","Chromosome",0.529340092218267,0.800132286936109,"eutH","Ethanolamine utilisation protein, EutH","E","Amino acid transport and metabolism","Metabolism"
"SL1344_2426","Chromosome",0.269089615958409,-1.07615501469952,"eutE","Aldehyde dehydrogenase family","C","Energy production and conversion","Metabolism"
"SL1344_2427","Chromosome",0.962651031214003,0.163563661692692,"eutN","Ethanolamine utilisation protein EutN/carboxysome","CQ","Energy production and conversion;Secondary metabolites biosynthesis, transport, and catabolism","Metabolism"
"SL1344_2429","Chromosome",0.787218349809346,-0.541306164677888,"eutD","Phosphate acetyl/butaryl transferase","C","Energy production and conversion","Metabolism"
"SL1344_2430","Chromosome",0.451997405996205,-0.770816437390427,"eutT","Cobalamin adenosyltransferase","E","Amino acid transport and metabolism","Metabolism"
"SL1344_2435","Chromosome",0.821409603569882,0.405159032667321,"maeB","Malic enzyme, NAD binding domain","C","Energy production and conversion","Metabolism"
"SL1344_2436","Chromosome",0.39076235225457,0.880218005144386,"tal","Transaldolase is important for the balance of metabolites in the pentose-phosphate pathway","F","Nucleotide transport and metabolism","Metabolism"
"SL1344_2437","Chromosome",0.646753128288663,0.636892950335592,"tktB","Catalyzes the transfer of a two-carbon ketol group from a ketose donor to an aldose acceptor, via a covalent intermediate with the cofactor thiamine pyrophosphate","G","Carbohydrate transport and metabolism","Metabolism"
"SL1344_2438","Chromosome",0.962251625991354,-0.16365828236824,"SL1344_2438","-","-","no category","no theme"
"SL1344_2440","Chromosome",0.0789462611819512,1.45239136031716,"yffH","NUDIX domain","L","Replication, recombination and repair ","Information storage and processing"
"SL1344_2441","Chromosome",0.819477971583112,0.409840407957717,"SL1344_2441","Beta-lactamase","V","Defense mechanisms","Cellular processes and signaling"
"SL1344_2442","Chromosome",0.409012955810051,0.879176852046604,"aegA","Dihydroprymidine dehydrogenase domain II, 4Fe-4S cluster","C","Energy production and conversion","Metabolism"
"SL1344_2443","Chromosome",0.789418185140559,-0.44088246066313,"narQ","Type IV pili methyl-accepting chemotaxis transducer N-term","T","Signal transduction mechanisms","Cellular processes and signaling"
"SL1344_2444","Chromosome",0.372386012839732,0.933850454130685,"acrD","AcrB/AcrD/AcrF family","U"," Intracellular trafficking, secretion, and vesicular transport","Cellular processes and signaling"
"SL1344_2445","Chromosome",0.790799160381339,-0.401966806068387,"yffB","ArsC family","P","Inorganic ion transport and metabolism","Metabolism"
"SL1344_2448","Chromosome",0.752054769876044,-0.451904405788653,"ypfI","Catalyzes the formation of N(4)-acetylcytidine (ac(4)C) at the wobble position of tRNA(Met), by using acetyl-CoA as an acetyl donor and ATP (or GTP)","J"," Translation, ribosomal structure and biogenesis","Information storage and processing"
"SL1344_2449","Chromosome",0.848823932031549,-0.499366394257371,"SL1344_2449","Putative neutral zinc metallopeptidase","S","Function Unknown","Poorly characterised"
"SL1344_2451","Chromosome",0.962704553728378,-0.122752678942452,"nlpB","Part of the outer membrane protein assembly complex, which is involved in assembly and insertion of beta-barrel proteins into the outer membrane","M","Cell wall/membrane/envelop biogenesis","Cellular processes and signaling"
"SL1344_2453","Chromosome",0.311933110822328,-0.957001505508443,"gcvR","ACT domain","E","Amino acid transport and metabolism","Metabolism"
"SL1344_2456","Chromosome",0.850242398008563,-0.445233475226431,"perM","AI-2E family transporter","S","Function Unknown","Poorly characterised"
"SL1344_2457","Chromosome",0.397175425812757,-1.10085741810065,"SL1344_2457","Functions as both a chaperone and a metalloprotease. Maintains the integrity of the outer membrane by promoting either the assembly or the elimination of outer membrane proteins, depending on their folding state","S","Function Unknown","Poorly characterised"
"SL1344_2458","Chromosome",0.998553787855402,0.0419572213021664,"yfgD","ArsC family","P","Inorganic ion transport and metabolism","Metabolism"
"SL1344_2461","Chromosome",0.919626376702981,0.250089704548767,"upp","Catalyzes the conversion of uracil and 5-phospho-alpha- D-ribose 1-diphosphate (PRPP) to UMP and diphosphate","F","Nucleotide transport and metabolism","Metabolism"
"SL1344_2463","Chromosome",1.79e-05,-2.74127059233568,"purN","Catalyzes the transfer of a formyl group from 10- formyltetrahydrofolate to 5-phospho-ribosyl-glycinamide (GAR), producing 5-phospho-ribosyl-N-formylglycinamide (FGAR) and tetrahydrofolate","F","Nucleotide transport and metabolism","Metabolism"
"SL1344_2464","Chromosome",0.195360850891756,1.63646425431836,"ppk","Catalyzes the reversible transfer of the terminal phosphate of ATP to form a long-chain polyphosphate (polyP)","F","Nucleotide transport and metabolism","Metabolism"
"SL1344_2465","Chromosome",0.851562847749795,0.584362064534123,"ppx","Ppx/GppA phosphatase family","FP","Nucleotide transport and metabolism;Inorganic ion transport and metabolism","Metabolism"
"SL1344_2466","Chromosome",0.155333366230135,1.19703575066027,"SL1344_2466","MASE1","T","Signal transduction mechanisms","Cellular processes and signaling"
"SL1344_2469","Chromosome",0.885999686311252,0.324469992061796,"SL1344_2469","Protein of unknown function (DUF1493)","S","Function Unknown","Poorly characterised"
"SL1344_2470","Chromosome",0.973474091557732,0.158024427661495,"SL1344_2470","transposition","L","Replication, recombination and repair ","Information storage and processing"
"SL1344_2471","Chromosome",6.04e-36,-15,"guaA","Catalyzes the synthesis of GMP from XMP","F","Nucleotide transport and metabolism","Metabolism"
"SL1344_2472","Chromosome",3.68e-37,-15,"guaB","Catalyzes the conversion of inosine 5'-phosphate (IMP) to xanthosine 5'-phosphate (XMP), the first committed and rate- limiting step in the de novo synthesis of guanine nucleotides, and therefore plays an important role in the regulation of cell growth","F","Nucleotide transport and metabolism","Metabolism"
"SL1344_2473","Chromosome",0.102474259802578,-1.33304761151453,"xseA","Bidirectionally degrades single-stranded DNA into large acid-insoluble oligonucleotides, which are then degraded further into small acid-soluble oligonucleotides","L","Replication, recombination and repair ","Information storage and processing"
"SL1344_2474","Chromosome",0.442443686020881,0.851825364899568,"shdA","Autotransporter beta-domain","MU","Cell wall/membrane/envelop biogenesis; Intracellular trafficking, secretion, and vesicular transport","Cellular processes and signaling"
"SL1344_2475","Chromosome",0.174262484741842,1.29714795185671,"ratB","Salmonella repeat of unknown function (DUF824)","M","Cell wall/membrane/envelop biogenesis","Cellular processes and signaling"
"SL1344_2477","Chromosome",0.272083243381461,1.08623557695695,"ratA","Salmonella repeat of unknown function (DUF824)","M","Cell wall/membrane/envelop biogenesis","Cellular processes and signaling"
"SL1344_2478","Chromosome",1,-0.000320415766969172,"sinI","-","-","no category","no theme"
"SL1344_2479","Chromosome",0.678377372905489,0.602014521891069,"sinH","Pfam:Invasin_beta","M","Cell wall/membrane/envelop biogenesis","Cellular processes and signaling"
"SL1344_2480","Chromosome",0.698383952448427,0.571780487781123,"yfgJ","zinc-ribbons","S","Function Unknown","Poorly characterised"
"SL1344_2488","Chromosome",0.000147347769292908,-2.2460085403978,"ndk","Major role in the synthesis of nucleoside triphosphates other than ATP. The ATP gamma phosphate is transferred to the NDP beta phosphate via a ping-pong mechanism, using a phosphorylated active-site intermediate","F","Nucleotide transport and metabolism","Metabolism"
"SL1344_2489","Chromosome",0.596521125850349,0.798517324363718,"SL1344_2489","4Fe-4S dicluster domain","C","Energy production and conversion","Metabolism"
"SL1344_2490","Chromosome",0.812660941495279,-0.381228541755355,"SL1344_2490","DMSO reductase anchor subunit (DmsC)","S","Function Unknown","Poorly characterised"
"SL1344_2492","Chromosome",0.662895658166296,-0.586531176398112,"SL1344_2492","Molybdopterin oxidoreductase Fe4S4 domain","C","Energy production and conversion","Metabolism"
"SL1344_2493","Chromosome",0.348058907391018,1.00961193445019,"pbpC","Penicillin-Binding Protein C-terminus Family","M","Cell wall/membrane/envelop biogenesis","Cellular processes and signaling"
"SL1344_2494","Chromosome",0.427393113049434,-0.80061159135263,"SL1344_2494","Alpha-2-Macroglobulin","S","Function Unknown","Poorly characterised"
"SL1344_2496","Chromosome",0.888505537618305,0.306399848860273,"SL1344_2496","Domain of unknown function (DUF5066)","S","Function Unknown","Poorly characterised"
"SL1344_2497","Chromosome",0.663576081663748,0.602596984401581,"sseBb","SseB protein N-terminal domain","S","Function Unknown","Poorly characterised"
"SL1344_2498","Chromosome",0.731605719661981,-0.477689010683389,"pepB","Probably plays an important role in intracellular peptide degradation","E","Amino acid transport and metabolism","Metabolism"
"SL1344_2499","Chromosome",0.930041397127422,-0.178130205604471,"yfhJ","Iron-sulphur cluster assembly","S","Function Unknown","Poorly characterised"
"SL1344_2500","Chromosome",5.53e-05,-2.27868756819741,"fdx","2Fe-2S iron-sulfur cluster binding domain","C","Energy production and conversion","Metabolism"
"SL1344_2501","Chromosome",1.16e-15,-5.4715201602569,"hscA","Chaperone involved in the maturation of iron-sulfur cluster-containing proteins. Has a low intrinsic ATPase activity which is markedly stimulated by HscB. Involved in the maturation of IscU","F","Nucleotide transport and metabolism","Metabolism"
"SL1344_2503","Chromosome",8.27e-16,-4.54563588604257,"iscA","Iron-sulphur cluster biosynthesis","C","Energy production and conversion","Metabolism"
"SL1344_2504","Chromosome",4.83e-12,-4.22335319674151,"nifU","A scaffold on which IscS assembles Fe-S clusters. It is likely that Fe-S cluster coordination is flexible as the role of this complex is to build and then hand off Fe-S clusters","C","Energy production and conversion","Metabolism"
"SL1344_2507","Chromosome",0.985543756380499,-0.0405360234964597,"SL1344_2507","Catalyzes the formation of 2'O-methylated cytidine (Cm32) or 2'O-methylated uridine (Um32) at position 32 in tRNA","J"," Translation, ribosomal structure and biogenesis","Information storage and processing"
"SL1344_2509","Chromosome",0.108529723200876,1.30767659603525,"SL1344_2509","Prolyl oligopeptidase family","S","Function Unknown","Poorly characterised"
"SL1344_2510","Chromosome",0.925791223305928,0.230315968816158,"asrA","4Fe-4S dicluster domain","C","Energy production and conversion","Metabolism"
"SL1344_2514","Chromosome",0.599951809432477,0.691543039701892,"SL1344_2514","Protein of unknown function (DUF1007)","S","Function Unknown","Poorly characterised"
"SL1344_2515","Chromosome",0.695564713405623,0.572614154144057,"csiE","PRD domain","K","Transcription","Information storage and processing"
"SL1344_2516","Chromosome",0.523755814494763,-0.702055066118756,"hcaT","LacY proton/sugar symporter","EGP","Amino acid transport and metabolism;Carbohydrate transport and metabolism;Inorganic ion transport and metabolism","Metabolism"
"SL1344_2517","Chromosome",0.00198137317290021,-1.99591535141586,"glyA","Catalyzes the reversible interconversion of serine and glycine with tetrahydrofolate (THF) serving as the one-carbon carrier. This reaction serves as the major source of one-carbon groups required for the biosynthesis of purines, thymidylate, methionine, and other important biomolecules. Also exhibits THF- independent aldolase activity toward beta-hydroxyamino acids, producing glycine and aldehydes, via a retro-aldol mechanism","E","Amino acid transport and metabolism","Metabolism"
"SL1344_2518","Chromosome",0.747806308519517,0.522461350665609,"hmpA","Is involved in NO detoxification in an aerobic process, termed nitric oxide dioxygenase (NOD) reaction that utilizes O(2) and NAD(P)H to convert NO to nitrate, which protects the bacterium from various noxious nitrogen compounds. Therefore, plays a central role in the inducible response to nitrosative stress","C","Energy production and conversion","Metabolism"
"SL1344_2519","Chromosome",0.0706528402439576,1.39632928554237,"cadC","Transcriptional regulatory protein, C terminal","K","Transcription","Information storage and processing"
"SL1344_2520","Chromosome",0.576111376753384,0.700137415681317,"cadB","Amino acid permease","E","Amino acid transport and metabolism","Metabolism"
"SL1344_2522","Chromosome",0.942126190463283,-0.158659065742921,"yjdL","POT family","U"," Intracellular trafficking, secretion, and vesicular transport","Cellular processes and signaling"
"SL1344_2523","Chromosome",0.466945437597069,-0.738947584050764,"glnB","Nitrogen regulatory protein P-II","K","Transcription","Information storage and processing"
"SL1344_2524","Chromosome",0.653601707235522,-0.569016490007639,"yfhA","Sigma-54 interaction domain","F","Nucleotide transport and metabolism","Metabolism"
"SL1344_2526","Chromosome",0.350037372602293,-0.892302817094482,"yfhK","His Kinase A (phosphoacceptor) domain","T","Signal transduction mechanisms","Cellular processes and signaling"
"SL1344_2527","Chromosome",5.08e-28,-8.78822040579206,"purG","Phosphoribosylformylglycinamidine synthase involved in the purines biosynthetic pathway. Catalyzes the ATP-dependent conversion of formylglycinamide ribonucleotide (FGAR) and glutamine to yield formylglycinamidine ribonucleotide (FGAM) and glutamate","F","Nucleotide transport and metabolism","Metabolism"
"SL1344_2529","Chromosome",0.736352567727476,0.527410183002885,"yfhD","Murein-degrading enzyme that degrades murein glycan strands and insoluble, high-molecular weight murein sacculi, with the concomitant formation of a 1,6-anhydromuramoyl product. Lytic transglycosylases (LTs) play an integral role in the metabolism of the peptidoglycan (PG) sacculus. Their lytic action creates space within the PG sacculus to allow for its expansion as well as for the insertion of various structures such as secretion systems and flagella","M","Cell wall/membrane/envelop biogenesis","Cellular processes and signaling"
"SL1344_2530","Chromosome",0.393349344245492,0.91848457810375,"yfhC","Catalyzes the deamination of adenosine to inosine at the wobble position 34 of tRNA(Arg2)","F","Nucleotide transport and metabolism","Metabolism"
"SL1344_2531","Chromosome",0.0558875231514838,-1.75306475284319,"yfhB","haloacid dehalogenase-like hydrolase","E","Amino acid transport and metabolism","Metabolism"
"SL1344_2532","Chromosome",1,0.0115940309339729,"SL1344_2532","phosphotransferase system, EIIB","G","Carbohydrate transport and metabolism","Metabolism"
"SL1344_2534","Chromosome",0.975376280163391,-0.0671049758033224,"yfhH","Helix-turn-helix domain, rpiR family","K","Transcription","Information storage and processing"
"SL1344_2535","Chromosome",0.077449807672021,1.36842968479097,"SL1344_2535","Catalyzes the NADPH-dependent reduction of ketopantoate into pantoic acid","H","Coenzyme transport and metabolism","Metabolism"
"SL1344_2536","Chromosome",0.567508460692913,0.726551996671069,"SL1344_2536","Major facilitator superfamily","P","Inorganic ion transport and metabolism","Metabolism"
"SL1344_2537","Chromosome",0.458830918145074,-0.754753180367208,"SL1344_2537","LysR substrate binding domain","K","Transcription","Information storage and processing"
"SL1344_2545","Chromosome",1.87e-08,-3.24662654569865,"lepA","Required for accurate and efficient protein synthesis under certain stress conditions. May act as a fidelity factor of the translation reaction, by catalyzing a one-codon backward translocation of tRNAs on improperly translocated ribosomes. Back- translocation proceeds from a post-translocation (POST) complex to a pre-translocation (PRE) complex, thus giving elongation factor G a second chance to translocate the tRNAs correctly. Binds to ribosomes in a GTP-dependent manner","F","Nucleotide transport and metabolism","Metabolism"
"SL1344_2546","Chromosome",0.143860529507939,1.34542835395921,"gogB","Leucine-rich repeat (LRR) protein","S","Function Unknown","Poorly characterised"
"SL1344_2547","Chromosome",0.572667779962484,-0.638556691950662,"SL1344_2547","hypothetical transposase",NA,"no category","no theme"
"SL1344_2551","Chromosome",0.371048284884934,0.911394935140419,"SL1344_2551","Appr-1'-p processing enzyme","S","Function Unknown","Poorly characterised"
"SL1344_2552","Chromosome",0.962251625991354,-0.139596249096374,"SL1344_2552","Phage Tail Collar Domain","M","Cell wall/membrane/envelop biogenesis","Cellular processes and signaling"
"SL1344_2553","Chromosome",0.361139194454097,0.960960124663488,"SL1344_2553","Fibronectin type III protein","D","Cell cycle control, cell division, chromosome partitioning","Cellular processes and signaling"
"SL1344_2554","Chromosome",0.0211835746686978,1.64856245558134,"SL1344_2554","virus tail assembly","S","Function Unknown","Poorly characterised"
"SL1344_2555","Chromosome",0.721762535822887,0.53453471703269,"SL1344_2555","JAB/MPN domain","M","Cell wall/membrane/envelop biogenesis","Cellular processes and signaling"
"SL1344_2556","Chromosome",1,0.0125544649284885,"SL1344_2556","Phage minor tail protein L","S","Function Unknown","Poorly characterised"
"SL1344_2557","Chromosome",0.981323757649253,-0.051690440711053,"SL1344_2557","Phage minor tail protein","S","Function Unknown","Poorly characterised"
"SL1344_2558","Chromosome",0.329636201909865,-0.919406620233329,"SL1344_2558","tail length tape measure","D","Cell cycle control, cell division, chromosome partitioning","Cellular processes and signaling"
"SL1344_2561","Chromosome",0.971791755992428,-0.0787900097608932,"SL1344_2561","Lambda phage tail tube protein, TTP","N","Cell motility","Cellular processes and signaling"
"SL1344_2563","Chromosome",0.226225607959739,1.08391241720438,"gipA","Probable transposase","L","Replication, recombination and repair ","Information storage and processing"
"SL1344_2567","Chromosome",0.510224149836012,0.785050627225398,"SL1344_2567","Phage major capsid protein E","S","Function Unknown","Poorly characterised"
"SL1344_2569","Chromosome",0.130919621242674,-1.14431998680385,"SL1344_2569","Peptidase family S49","OU","Post-translational modification, protein turnover, and chaperones; Intracellular trafficking, secretion, and vesicular transport","Cellular processes and signaling"
"SL1344_2570","Chromosome",0.559566537691666,0.723783191102349,"SL1344_2570","Phage portal protein, lambda family","S","Function Unknown","Poorly characterised"
"SL1344_2572","Chromosome",0.333054768144338,1.12866080560874,"SL1344_2572","Phage terminase large subunit (GpA)","S","Function Unknown","Poorly characterised"
"SL1344_2574","Chromosome",0.970389012194294,0.154132697764685,"SL1344_2574","lysozyme inhibitor activity","S","Function Unknown","Poorly characterised"
"SL1344_2578","Chromosome",0.900799624714891,0.279863901736246,"SL1344_2578","ORF6N domain","S","Function Unknown","Poorly characterised"
"SL1344_2579","Chromosome",0.00110907529016426,-1.90585699415124,"SL1344_2579","Phage antitermination protein Q","S","Function Unknown","Poorly characterised"
"SL1344_2580","Chromosome",0.979824645719738,0.0950951039523652,"SL1344_2580","-","-","no category","no theme"
"SL1344_2582","Chromosome",0.841378144834621,-0.518121137188385,"SL1344_2582","Protein of unknown function (DUF1367)","S","Function Unknown","Poorly characterised"
"SL1344_2585","Chromosome",0.817521989287725,0.458462695765861,"SL1344_2585","predicted bacteriophage protein",NA,"no category","no theme"
"SL1344_2586","Chromosome",0.942266057375502,0.192518972914122,"SL1344_2586","-","-","no category","no theme"
"SL1344_2587","Chromosome",0.606573104263788,-0.640365435674638,"SL1344_2587","Protein of unknown function (DUF550)","S","Function Unknown","Poorly characterised"
"SL1344_2590","Chromosome",0.504563257770609,-0.729592691134602,"gpP","Replication protein P","S","Function Unknown","Poorly characterised"
"SL1344_2594","Chromosome",0.960811783165587,0.156341145088667,"SL1344_2594","AAA domain","D","Cell cycle control, cell division, chromosome partitioning","Cellular processes and signaling"
"SL1344_2597","Chromosome",0.44013779314435,0.849565378803974,"recEb","double-stranded DNA specific 5'-3' exodeoxyribonuclease activity","S","Function Unknown","Poorly characterised"
"SL1344_2599","Chromosome",0.939441764668214,-0.290087949906773,"SL1344_2599","-","-","no category","no theme"
"SL1344_2600","Chromosome",0.640622152305495,0.634709219154566,"SL1344_2600","Arm DNA-binding domain","L","Replication, recombination and repair ","Information storage and processing"
"SL1344_2602","Chromosome",0.789502285337578,-0.406351058626879,"rseB","MucB/RseB C-terminal domain","T","Signal transduction mechanisms","Cellular processes and signaling"
"SL1344_2605","Chromosome",0.978124389614833,0.09682513802941,"nadB","Catalyzes the oxidation of L-aspartate to iminoaspartate","H","Coenzyme transport and metabolism","Metabolism"
"SL1344_2606","Chromosome",0.334566082122662,-0.892551061809158,"yfiC","Specifically methylates the adenine in position 37 of tRNA(1)(Val) (anticodon cmo5UAC)","J"," Translation, ribosomal structure and biogenesis","Information storage and processing"
"SL1344_2607","Chromosome",1.99e-07,-3.11902692646175,"srmB","DEAD-box RNA helicase involved in the assembly of the 50S ribosomal subunit at low temperature. Exhibits RNA-stimulated ATP hydrolysis and RNA unwinding activity","F","Nucleotide transport and metabolism","Metabolism"
"SL1344_2608","Chromosome",0.605358367924622,-0.633857726841225,"yfiE","LysR substrate binding domain","K","Transcription","Information storage and processing"
"SL1344_2609","Chromosome",0.8180213410739,-0.359376994071027,"yfiK","LysE type translocator","U"," Intracellular trafficking, secretion, and vesicular transport","Cellular processes and signaling"
