"locus_tag","Molecule","FDR","logFC","gene_name","genefunc","COG","description","theme"
"SL1344_1227","Chromosome",0.728439036453284,-0.485214816696774,"yeaC","Protein of unknown function (DUF1315)","S","Function Unknown","Poorly characterised"
"SL1344_1228","Chromosome",0.817781378039229,-0.646856340003869,"nam","Isochorismatase family","Q","Secondary metabolites biosynthesis, transport, and catabolism","Metabolism"
"SL1344_1229","Chromosome",0.135197253318704,-1.16136213834507,"ansA","Asparaginase, N-terminal","EJ","Amino acid transport and metabolism; Translation, ribosomal structure and biogenesis","Metabolism;Information storage and processing"
"SL1344_1230","Chromosome",0.285197143626116,-0.985101419760605,"sppA","Peptidase family S49","OU","Post-translational modification, protein turnover, and chaperones; Intracellular trafficking, secretion, and vesicular transport","Cellular processes and signaling"
"SL1344_1231","Chromosome",0.212544614450627,1.11770164948859,"ydjA","Nitroreductase family","C","Energy production and conversion","Metabolism"
"SL1344_1232","Chromosome",0.00356077271318482,1.96995279224192,"selD","Synthesizes selenophosphate from selenide and ATP","F","Nucleotide transport and metabolism","Metabolism"
"SL1344_1233","Chromosome",0.426063592080679,0.895288945734998,"topB","Releases the supercoiling and torsional tension of DNA, which is introduced during the DNA replication and transcription, by transiently cleaving and rejoining one strand of the DNA duplex. Introduces a single-strand break via transesterification at a target site in duplex DNA. The scissile phosphodiester is attacked by the catalytic tyrosine of the enzyme, resulting in the formation of a DNA-(5'-phosphotyrosyl)-enzyme intermediate and the expulsion of a 3'-OH DNA strand. The free DNA strand then undergoes passage around the unbroken strand, thus removing DNA supercoils. Finally, in the religation step, the DNA 3'-OH attacks the covalent intermediate to expel the active-site tyrosine and restore the DNA phosphodiester backbone","L","Replication, recombination and repair ","Information storage and processing"
"SL1344_1234","Chromosome",0.7715946485876,0.475209064747786,"gdhA","Glu/Leu/Phe/Val dehydrogenase, dimerisation domain","E","Amino acid transport and metabolism","Metabolism"
"SL1344_1236","Chromosome",0.945035849997848,0.214954578676586,"SL1344_1236","NUDIX domain","L","Replication, recombination and repair ","Information storage and processing"
"SL1344_1238","Chromosome",0.698383952448427,0.575637948014231,"argDa","Catalyzes the transamination of N(2)-succinylornithine and alpha-ketoglutarate into N(2)-succinylglutamate semialdehyde and glutamate. Can also act as an acetylornithine aminotransferase","E","Amino acid transport and metabolism","Metabolism"
"SL1344_1239","Chromosome",0.790799160381339,1.48875602696889,"astA","Catalyzes the transfer of succinyl-CoA to arginine to produce N(2)-succinylarginine","E","Amino acid transport and metabolism","Metabolism"
"SL1344_1240","Chromosome",0.83120243548357,0.412110856649095,"astD","Catalyzes the NAD-dependent reduction of succinylglutamate semialdehyde into succinylglutamate","C","Energy production and conversion","Metabolism"
"SL1344_1241","Chromosome",0.964553016233419,-0.100626709908464,"astB","Catalyzes the hydrolysis of N(2)-succinylarginine into N(2)-succinylornithine, ammonia and CO(2)","E","Amino acid transport and metabolism","Metabolism"
"SL1344_1243","Chromosome",0.725155668031661,0.809217687645649,"SL1344_1243","Heavy-metal resistance","NPTU","Cell motility;Inorganic ion transport and metabolism;Signal transduction mechanisms; Intracellular trafficking, secretion, and vesicular transport","Cellular processes and signaling;Metabolism"
"SL1344_1244","Chromosome",0.189905522735921,1.56642679126938,"SL1344_1244","Nuclease subunit of the excinuclease complex","L","Replication, recombination and repair ","Information storage and processing"
"SL1344_1247","Chromosome",0.16411222427295,1.23919911470823,"celA","PTS system, Lactose/Cellobiose specific IIB subunit","G","Carbohydrate transport and metabolism","Metabolism"
"SL1344_1248","Chromosome",0.32373200803015,1.00084154460612,"celB","The phosphoenolpyruvate-dependent sugar phosphotransferase system (PTS), a major carbohydrate active - transport system, catalyzes the phosphorylation of incoming sugar substrates concomitant with their translocation across the cell membrane","U"," Intracellular trafficking, secretion, and vesicular transport","Cellular processes and signaling"
"SL1344_1250","Chromosome",0.937230918141424,0.203660024961426,"celD","AraC-like ligand binding domain","K","Transcription","Information storage and processing"
"SL1344_1251","Chromosome",0.6547948537591,-0.567153145192533,"celF","Family 4 glycosyl hydrolase","G","Carbohydrate transport and metabolism","Metabolism"
"SL1344_1252","Chromosome",0.86770713901441,2.93924780491053,"celG","Involved in the degradation of chitin. ChbG is essential for growth on the acetylated chitooligosaccharides chitobiose and chitotriose but is dispensable for growth on cellobiose and chitosan dimer, the deacetylated form of chitobiose. Deacetylation of chitobiose-6-P and chitotriose-6-P is necessary for both the activation of the chb promoter by the regulatory protein ChbR and the hydrolysis of phosphorylated beta-glucosides by the phospho- beta-glucosidase ChbF. Catalyzes the removal of only one acetyl group from chitobiose-6-P to yield monoacetylchitobiose-6-P, the inducer of ChbR and the substrate of ChbF","F","Nucleotide transport and metabolism","Metabolism"
"SL1344_1253","Chromosome",0.747806308519517,0.514406508928675,"katE","Serves to protect cells from the toxic effects of hydrogen peroxide","P","Inorganic ion transport and metabolism","Metabolism"
"SL1344_1256","Chromosome",0.660610096570285,0.63905216129151,"ydjM","LexA-binding, inner membrane-associated putative hydrolase","S","Function Unknown","Poorly characterised"
"SL1344_1258","Chromosome",0.706953144988463,0.549900572979094,"yniB","YniB-like protein","S","Function Unknown","Poorly characterised"
"SL1344_1259","Chromosome",0.755203174518862,0.928144035408308,"SL1344_1259","Fructosamine kinase","G","Carbohydrate transport and metabolism","Metabolism"
"SL1344_1263","Chromosome",0.544867652195301,0.750100281000052,"SL1344_1263","Uncharacterized protein conserved in bacteria (DUF2219)","S","Function Unknown","Poorly characterised"
"SL1344_1265","Chromosome",0.576111376753384,0.710037037418577,"SL1344_1265","DNA/RNA non-specific endonuclease","F","Nucleotide transport and metabolism","Metabolism"
"SL1344_1266","Chromosome",0.251713922097234,1.11561326589171,"rfc","-","-","no category","no theme"
"SL1344_1274","Chromosome",0.204402786730901,1.57985074812352,"btuC","Part of the ABC transporter complex BtuCDF involved in vitamin B12 import. Involved in the translocation of the substrate across the membrane","U"," Intracellular trafficking, secretion, and vesicular transport","Cellular processes and signaling"
"SL1344_1275","Chromosome",0.962251625991354,0.15064800546563,"btuE","Non-specific peroxidase that can use thioredoxin or glutathione as a reducing agent","O","Post-translational modification, protein turnover, and chaperones","Cellular processes and signaling"
"SL1344_1276","Chromosome",0.993980612791149,-0.0156904727004295,"btuD","Part of the ABC transporter complex BtuCDF involved in vitamin B12 import. Responsible for energy coupling to the transport system","H","Coenzyme transport and metabolism","Metabolism"
"SL1344_1278","Chromosome",0.654923523613805,-0.549184522050498,"ydiV","EAL domain","K","Transcription","Information storage and processing"
"SL1344_1279","Chromosome",0.789802059767004,-0.419736282938624,"ydiU","Uncharacterized ACR, YdiU/UPF0061 family","S","Function Unknown","Poorly characterised"
"SL1344_1283","Chromosome",0.947811883344187,0.181782523931974,"pps","Catalyzes the phosphorylation of pyruvate to phosphoenolpyruvate","H","Coenzyme transport and metabolism","Metabolism"
"SL1344_1284","Chromosome",0.721149176986176,0.550226359329881,"ydiD","AMP-binding enzyme C-terminal domain","IQ","Lipid transport and metabolism;Secondary metabolites biosynthesis, transport, and catabolism","Metabolism"
"SL1344_1285","Chromosome",0.666420813756111,-0.555983802053313,"ydiT","Could be a 3Fe-4S cluster-containing protein","C","Energy production and conversion","Metabolism"
"SL1344_1286","Chromosome",0.432086492796469,0.879397736585908,"ydiS","part of an electron transfer system required for anaerobic carnitine reduction","C","Energy production and conversion","Metabolism"
"SL1344_1287","Chromosome",0.320849626403278,1.01277036609899,"ydiR","Required for anaerobic carnitine reduction. May bring reductant to CaiA","C","Energy production and conversion","Metabolism"
"SL1344_1288","Chromosome",0.887519439958936,0.306096016120783,"ydiQ","Required for anaerobic carnitine reduction. May bring reductant to CaiA","C","Energy production and conversion","Metabolism"
"SL1344_1289","Chromosome",0.0625879556185682,1.49033218124702,"ydiP","transcriptional regulator","K","Transcription","Information storage and processing"
"SL1344_1290","Chromosome",0.188231778444262,1.19670105284638,"ydiO","Catalyzes the reduction of crotonobetainyl-CoA to gamma- butyrobetainyl-CoA","I","Lipid transport and metabolism","Metabolism"
"SL1344_1291","Chromosome",0.305965194985682,1.04827808318664,"ydiF","CoA transferase having broad substrate specificity for short-chain acyl-CoA thioesters with the activity decreasing when the length of the carboxylic acid chain exceeds four carbons","I","Lipid transport and metabolism","Metabolism"
"SL1344_1292","Chromosome",7.76e-29,-8.33235544032841,"aroD","Involved in the third step of the chorismate pathway, which leads to the biosynthesis of aromatic amino acids. Catalyzes the cis-dehydration of 3-dehydroquinate (DHQ) and introduces the first double bond of the aromatic ring to yield 3- dehydroshikimate","E","Amino acid transport and metabolism","Metabolism"
"SL1344_1293","Chromosome",0.38045720693902,1.23306675871287,"aroE","The actual biological function of YdiB remains unclear, nor is it known whether 3-dehydroshikimate or quinate represents the natural substrate. Catalyzes the reversible NAD-dependent reduction of both 3-dehydroshikimate (DHSA) and 3-dehydroquinate to yield shikimate (SA) and quinate, respectively. It can use both NAD or NADP for catalysis, however it has higher catalytic efficiency with NAD","E","Amino acid transport and metabolism","Metabolism"
"SL1344_1294","Chromosome",0.538217067679977,-0.670113909382022,"ydiN","Major Facilitator Superfamily","EGP","Amino acid transport and metabolism;Carbohydrate transport and metabolism;Inorganic ion transport and metabolism","Metabolism"
"SL1344_1296","Chromosome",0.103842704634481,1.36315829203173,"ydiM","Major Facilitator Superfamily","EGP","Amino acid transport and metabolism;Carbohydrate transport and metabolism;Inorganic ion transport and metabolism","Metabolism"
"SL1344_1297","Chromosome",0.50523803838971,0.773851956709417,"ydiL","DNA binding","S","Function Unknown","Poorly characterised"
"SL1344_1298","Chromosome",0.923986658107821,1.82614068213687,"ydiK","AI-2E family transporter","S","Function Unknown","Poorly characterised"
"SL1344_1299","Chromosome",0.0954548075009419,1.382619651944,"ydiJ","FAD linked oxidases, C-terminal domain","C","Energy production and conversion","Metabolism"
"SL1344_1300","Chromosome",0.790799160381339,-0.481744625780168,"SL1344_1300","Catalyzes the hydrolysis of 1,4-dihydroxy-2-naphthoyl- CoA (DHNA-CoA) to 1,4-dihydroxy-2-naphthoate (DHNA)","Q","Secondary metabolites biosynthesis, transport, and catabolism","Metabolism"
"SL1344_1302","Chromosome",0.751887122703199,0.868839506492222,"SL1344_1302","Sodium:dicarboxylate symporter family","U"," Intracellular trafficking, secretion, and vesicular transport","Cellular processes and signaling"
"SL1344_1304","Chromosome",0.177168183593263,1.22826263112545,"sufB","Uncharacterized protein family (UPF0051)","O","Post-translational modification, protein turnover, and chaperones","Cellular processes and signaling"
"SL1344_1305","Chromosome",0.562488710580417,0.716244543066384,"sufC","ABC transporter","O","Post-translational modification, protein turnover, and chaperones","Cellular processes and signaling"
"SL1344_1306","Chromosome",0.544083838396465,0.754047100551006,"sufD","Uncharacterized protein family (UPF0051)","O","Post-translational modification, protein turnover, and chaperones","Cellular processes and signaling"
"SL1344_1307","Chromosome",0.204544864476682,1.23244687784531,"sufS","Cysteine desulfurases mobilize the sulfur from L- cysteine to yield L-alanine, an essential step in sulfur metabolism for biosynthesis of a variety of sulfur-containing biomolecules. Component of the suf operon, which is activated and required under specific conditions such as oxidative stress and iron limitation. Acts as a potent selenocysteine lyase in vitro, that mobilizes selenium from L-selenocysteine. Selenocysteine lyase activity is however unsure in vivo","H","Coenzyme transport and metabolism","Metabolism"
"SL1344_1312","Chromosome",2.63e-06,-2.71208628934941,"pykF","Pyruvate kinase, barrel domain","F","Nucleotide transport and metabolism","Metabolism"
"SL1344_1313","Chromosome",0.396368558849175,0.898574230919393,"orf48","Amino acid permease","E","Amino acid transport and metabolism","Metabolism"
"SL1344_1314","Chromosome",0.618826104017554,0.77013550045303,"orf32","Alpha/beta hydrolase family","I","Lipid transport and metabolism","Metabolism"
"SL1344_1315","Chromosome",0.564183398102038,0.740764500664073,"orf245","Putative glutamine amidotransferase","S","Function Unknown","Poorly characterised"
"SL1344_1316","Chromosome",0.369121789720199,0.916537509924358,"orf408","Catalyzes the phosphorylation of ribose at O-5 in a reaction requiring ATP and magnesium. The resulting D-ribose-5- phosphate can then be used either for sythesis of nucleotides, histidine, and tryptophan, or as a component of the pentose phosphate pathway","H","Coenzyme transport and metabolism","Metabolism"
"SL1344_1317","Chromosome",0.663576081663748,-0.661450175520512,"ttrA","Molybdopterin oxidoreductase Fe4S4 domain","C","Energy production and conversion","Metabolism"
"SL1344_1318","Chromosome",0.448732425494698,0.832593642483152,"ttrC","Polysulphide reductase, NrfD","C","Energy production and conversion","Metabolism"
"SL1344_1319","Chromosome",0.498181791968291,0.802965964256307,"ttrB","4Fe-4S dicluster domain","C","Energy production and conversion","Metabolism"
"SL1344_1320","Chromosome",0.259551112155086,1.09171779506658,"ttrS","ABC transporter, phosphonate, periplasmic substrate-binding protein","T","Signal transduction mechanisms","Cellular processes and signaling"
"SL1344_1321","Chromosome",0.392555126447172,0.888107056405059,"ttrR","Sigma-70, region 4","K","Transcription","Information storage and processing"
"SL1344_1324","Chromosome",0.0769020767827785,1.39250380081753,"orf242","MerR family regulatory protein","K","Transcription","Information storage and processing"
"SL1344_1325","Chromosome",6.22e-38,-15,"ssrB","Bacterial regulatory proteins, luxR family","KT","Transcription;Signal transduction mechanisms","Information storage and processing;Cellular processes and signaling"
"SL1344_1326","Chromosome",2.65e-35,-8.91498417152232,"ssrA","HAMP (Histidine kinases, Adenylyl cyclases, Methyl binding proteins, Phosphatases) domain","T","Signal transduction mechanisms","Cellular processes and signaling"
"SL1344_1327","Chromosome",9.02e-40,-15,"ssaB","-","-","no category","no theme"
"SL1344_1328","Chromosome",1.92e-46,-9.81708130386937,"ssaC","Bacterial type II/III secretion system short domain","NU","Cell motility; Intracellular trafficking, secretion, and vesicular transport","Cellular processes and signaling"
"SL1344_1329","Chromosome",3.18e-31,-7.64473095603096,"ssaD","Inner membrane component of T3SS, periplasmic domain","S","Function Unknown","Poorly characterised"
"SL1344_1333","Chromosome",6.65e-34,-8.92568032229048,"sscA","Mediates coordination of peptidoglycan synthesis and outer membrane constriction during cell division","S","Function Unknown","Poorly characterised"
"SL1344_1334","Chromosome",5.18e-42,-15,"sseC","Secretion system effector C (SseC) like family","S","Function Unknown","Poorly characterised"
"SL1344_1335","Chromosome",3.14e-19,-5.80521176441397,"sseD","-","-","no category","no theme"
"SL1344_1336","Chromosome",0.0146911748344985,-1.66619180754796,"sseE","Type III secretion system regulator (LcrR)","S","Function Unknown","Poorly characterised"
"SL1344_1338","Chromosome",0.00215949828756049,-1.79867444636161,"sseF","-","-","no category","no theme"
"SL1344_1339","Chromosome",0.00260353818894308,-1.80763013245752,"sseG","-","-","no category","no theme"
"SL1344_1340","Chromosome",2.59e-31,-7.0085542986036,"ssaG","Type III secretion needle MxiH, YscF, SsaG, EprI, PscF, EscF","S","Function Unknown","Poorly characterised"
"SL1344_1341","Chromosome",1.45e-20,-5.60605278437975,"ssaH","Protein of unknown function (DUF1039)","S","Function Unknown","Poorly characterised"
"SL1344_1343","Chromosome",1.4e-45,-15,"ssaJ","Secretory protein of YscJ/FliF family","U"," Intracellular trafficking, secretion, and vesicular transport","Cellular processes and signaling"
"SL1344_1344","Chromosome",1.4e-45,-15,"SL1344_1344","Type III secretion system subunit","S","Function Unknown","Poorly characterised"
"SL1344_1346","Chromosome",7.69e-34,-8.08411135903319,"ssaL","HrpJ-like domain","S","Function Unknown","Poorly characterised"
"SL1344_1348","Chromosome",1.12e-39,-9.82531553231741,"ssaV","FHIPEP family","U"," Intracellular trafficking, secretion, and vesicular transport","Cellular processes and signaling"
"SL1344_1349","Chromosome",7.41e-25,-15,"ssaN","ATP synthase alpha/beta family, nucleotide-binding domain","NU","Cell motility; Intracellular trafficking, secretion, and vesicular transport","Cellular processes and signaling"
"SL1344_1352","Chromosome",1.75e-37,-15,"ssaQ","Type III flagellar switch regulator (C-ring) FliN C-term","NU","Cell motility; Intracellular trafficking, secretion, and vesicular transport","Cellular processes and signaling"
"SL1344_1353","Chromosome",1.33e-26,-7.30740779157264,"ssaR","FliP family","U"," Intracellular trafficking, secretion, and vesicular transport","Cellular processes and signaling"
"SL1344_1354","Chromosome",1.45e-32,-8.02828606571447,"ssaS","Bacterial export proteins, family 3","U"," Intracellular trafficking, secretion, and vesicular transport","Cellular processes and signaling"
"SL1344_1355","Chromosome",5.19e-30,-7.85797764572855,"ssaT","Bacterial export proteins, family 1","U"," Intracellular trafficking, secretion, and vesicular transport","Cellular processes and signaling"
"SL1344_1356","Chromosome",5.45e-32,-8.28224446278931,"ssaU","FlhB HrpN YscU SpaS Family","U"," Intracellular trafficking, secretion, and vesicular transport","Cellular processes and signaling"
"SL1344_1357","Chromosome",0.405867607556203,0.878119066987979,"norM","Multidrug efflux pump that functions probably as a Na( ) drug antiporter","P","Inorganic ion transport and metabolism","Metabolism"
"SL1344_1359","Chromosome",0.216106460910248,-1.05410054063864,"cfa","FtsJ-like methyltransferase","M","Cell wall/membrane/envelop biogenesis","Cellular processes and signaling"
"SL1344_1360","Chromosome",0.722622142604572,0.575874001806493,"ydhC","Sugar (and other) transporter","EGP","Amino acid transport and metabolism;Carbohydrate transport and metabolism;Inorganic ion transport and metabolism","Metabolism"
"SL1344_1361","Chromosome",0.990412605107764,0.305585647272861,"ydhB","LysR substrate binding domain","K","Transcription","Information storage and processing"
"SL1344_1362","Chromosome",0.970323665526161,-0.0822915195836223,"purR","Is the main repressor of the genes involved in the de novo synthesis of purine nucleotides, regulating purB, purC, purEK, purF, purHD, purL, purMN and guaBA expression. PurR is allosterically activated to bind its cognate DNA by binding the purine corepressors, hypoxanthine or guanine, thereby effecting transcription repression","K","Transcription","Information storage and processing"
"SL1344_1363","Chromosome",0.108879949220206,-1.20392143032299,"sodB","radicals which are normally produced within the cells and which are toxic to biological systems","C","Energy production and conversion","Metabolism"
"SL1344_1364","Chromosome",0.410458871498664,0.901070628103131,"ydhO","NlpC/P60 family","M","Cell wall/membrane/envelop biogenesis","Cellular processes and signaling"
"SL1344_1365","Chromosome",0.379368836030521,-0.841439180261086,"ydhD","Glutaredoxin","C","Energy production and conversion","Metabolism"
"SL1344_1368","Chromosome",0.971824034049318,-0.10476407840303,"nemA","NADH:flavin oxidoreductase / NADH oxidase family","C","Energy production and conversion","Metabolism"
"SL1344_1369","Chromosome",0.984587542507345,-0.0472028938296004,"ydhM","Bacterial transcriptional repressor C-terminal","K","Transcription","Information storage and processing"
"SL1344_1370","Chromosome",0.811067846227154,-0.38525555143477,"ydhL","Protein of unknown function (DUF1289)","S","Function Unknown","Poorly characterised"
"SL1344_1371","Chromosome",0.962251625991354,-0.113479907968489,"ydhF","Aldo/keto reductase family","S","Function Unknown","Poorly characterised"
"SL1344_1372","Chromosome",0.168810010380582,-1.29003032744019,"sodCb","Destroys radicals which are normally produced within the cells and which are toxic to biological systems","P","Inorganic ion transport and metabolism","Metabolism"
"SL1344_1373","Chromosome",0.138757545129888,1.53132050625708,"SL1344_1373","Fusaric acid resistance protein-like","U"," Intracellular trafficking, secretion, and vesicular transport","Cellular processes and signaling"
"SL1344_1376","Chromosome",2.07e-27,-6.40128992389133,"slyA","Transcription regulator that can specifically activate or repress expression of target genes","K","Transcription","Information storage and processing"
"SL1344_1377","Chromosome",0.878049317561513,-0.311109666763797,"slyB","Glycine zipper 2TM domain","M","Cell wall/membrane/envelop biogenesis","Cellular processes and signaling"
"SL1344_1382","Chromosome",0.576111376753384,-0.643509898728969,"pdxY","Pyridoxal kinase involved in the salvage pathway of pyridoxal 5'-phosphate (PLP). Catalyzes the phosphorylation of pyridoxal to PLP","H","Coenzyme transport and metabolism","Metabolism"
"SL1344_1383","Chromosome",0.51265808908802,-15,"gst","Glutathione S-transferase, C-terminal domain","O","Post-translational modification, protein turnover, and chaperones","Cellular processes and signaling"
"SL1344_1384","Chromosome",0.760019490654987,0.51382302456089,"tppB","Proton-dependent permease that transports di- and tripeptides","U"," Intracellular trafficking, secretion, and vesicular transport","Cellular processes and signaling"
"SL1344_1386","Chromosome",0.0844702747939817,-1.35381313129855,"rnfE","Rnf-Nqr subunit, membrane protein","C","Energy production and conversion","Metabolism"
"SL1344_1387","Chromosome",0.32051374788366,-0.935732764491647,"rnfG","Part of a membrane complex involved in electron transport. Required to maintain the reduced state of SoxR","C","Energy production and conversion","Metabolism"
"SL1344_1388","Chromosome",0.817363973699526,-0.377480058763011,"rnfD","NQR2, RnfD, RnfE family","C","Energy production and conversion","Metabolism"
"SL1344_1389","Chromosome",0.355105943676422,-0.876892726715868,"rnfC","RnfC Barrel sandwich hybrid domain","C","Energy production and conversion","Metabolism"
"SL1344_1390","Chromosome",0.442443686020881,-0.78180772997999,"rnfB","Putative Fe-S cluster","C","Energy production and conversion","Metabolism"
"SL1344_1391","Chromosome",0.438096082475611,-0.793519397585225,"rnfA","Part of a membrane complex involved in electron transport. Required to maintain the reduced state of SoxR","C","Energy production and conversion","Metabolism"
"SL1344_1393","Chromosome",0.490127376133494,0.791638045076316,"ydgT","Haemolysin expression modulating protein","K","Transcription","Information storage and processing"
"SL1344_1394","Chromosome",0.427182832759325,0.849749470277902,"ydgJ","Oxidoreductase family, C-terminal alpha/beta domain","S","Function Unknown","Poorly characterised"
"SL1344_1395","Chromosome",0.740524093142613,0.517636226192279,"add","Adenosine/AMP deaminase","F","Nucleotide transport and metabolism","Metabolism"
"SL1344_1396","Chromosome",0.3500105298698,1.21110229652667,"ydgA","Bacterial protein of unknown function (DUF945)","S","Function Unknown","Poorly characterised"
"SL1344_1397","Chromosome",9.87e-10,-3.79869775303545,"manA","Phosphomannose isomerase type I","G","Carbohydrate transport and metabolism","Metabolism"
"SL1344_1398","Chromosome",0.749190004462358,-0.533410156126094,"fumA","Catalyzes the reversible hydration of fumarate to (S)- malate","C","Energy production and conversion","Metabolism"
"SL1344_1400","Chromosome",0.623444060048451,1.25799631399468,"fumC","Involved in the TCA cycle. Catalyzes the stereospecific interconversion of fumarate to L-malate","C","Energy production and conversion","Metabolism"
"SL1344_1401","Chromosome",0.811266738195717,-0.376179597803075,"tus","Trans-acting protein required for termination of DNA replication. Binds to DNA replication terminator sequences (terA to terF) to prevent the passage of replication forks. The termination efficiency will be affected by the affinity of this protein for the terminator sequence","J"," Translation, ribosomal structure and biogenesis","Information storage and processing"
